繰り返し (kurikaeshi)	 repetition; repeat; reiteration; iteration; refrain; cycle​; repeatedly
車椅子 (kurumaisu)	 wheelchair; folding push-chair
苦戦 (kusen)	 hard fight; close game; struggle; tight contest​
国々 (kuniguni)	 countries
くしゃみ	 sneeze
くたくた	 exhausted; tired; withered; worn out​
空洞 (kuudou)	 cave; hollow; cavity​
空間 (kuukan)	 space; room; airspace​
空席 (kuuseki)	 empty seat; unoccupied seat​; vacancy; vacant post​
空想 (kuusou)	 daydream; fantasy; fancy; vision
悔やむ (kuyamu)	 to mourn; to lament​; to be sorry; to regret; to repent​
崩す (kuzusu)	 to destroy; to demolish; to pull down; to tear down; to level​; to break (a bill); to change; to make change​
客観的 (kyakkanteki)	 objective
客席 (kyakuseki)	 guest seating (e.g. theater, stadium); passenger seat (e.g. taxi)​; audience
拒否 (kyohi)	 refusal; rejection; denial; veto​
曲線 (kyokusen)	 curve
極端 (kyokutan)	 extreme; extremity​
強風 (kyoufuu)	 strong wind; high wind; moderate gale​
教員 (kyouin)	 teacher; instructor; teaching staff; faculty member​
強弱 (kyoujaku)	 strength and weakness; (degree of) strength​; stress (of a sound); loudness​
強化 (kyouka)	 strengthening; intensifying; reinforcement; enhancement; solidification​
協会 (kyoukai)	 association; society; organization; organisation​
教師 (kyoushi)	 teacher (classroom)​
恐縮 (kyoushuku)	 feeling obliged; being grateful; being thankful; being sorry; being ashamed​
教養 (kyouyou)	 cultivation; refinement; culture; education​
共有 (kyouyuu)	 joint ownership; co-ownership; sharing (e.g. a viewpoint)​
旧  (kyuu)	 ex-; former; old​
休暇明け (kyuukaake)	 post-vacation
急病 (kyuubyou)	 sudden illness​
休業 (kyuugyou)	 closed (e.g. store); business suspended; shutdown; holiday​
求人 (kyuujin)	 recruiting; job offer; job vacancy​
休養 (kyuuyou)	 rest; break; recreation; recuperation; convalescence​
急増 (kyuuzou)	 rapid increase; proliferation; surge; explosion​
町並み (machinami)	 townscape; street (of stores and houses); (look of) stores and houses on street​
まぶた	 eyelid; eyelids​
間近 (madjika)	 proximity; nearness; soon; nearby​
窓際 (madogiwa)	 (at the) window​
窓口 (madoguchi)	 ticket window; teller window; counter​; contact person; point of contact​
魔法 (mahou)	 magic; witchcraft; sorcery​
前向き (maemuki)	 front-facing; forward-looking; positive; constructive
間際 (magiwa)	 the point just before; the point of doing; the verge of happening​
巻き込む (makikomu)	 to roll up; to enfold; to swallow up​; to involve; to drag into​
まく	 to scatter; to sprinkle; to strew​
真似る (maneru)	 to mimic; to imitate​
満員 (man’in)	 full house; no vacancy; sold out; standing room only; full (of people); crowded​
満足度 (manzokudo)	 (degree of) satisfaction​
稀 (mare)	 rare, seldom
真っ先 (massaki)	 the head; the foremost; beginning; the very front​
真っ白 (masshiro)	 pure white​
まとめる	 to collect; to put (it all) together; to integrate; to consolidate; to unify​; to summarize; to aggregate​; to bring to a conclusion; to finalize; to settle; to put in order
目 (me)	 (suffix) ordinal number suffix​
目に触れる (me ni fureru)
目新しい (meatarashii)	 original; novel; new​
目当て (meate)	 mark; guide; landmark​; purpose; aim; goal; intention; end
目立つ (medatsu)	 to be conspicuous; to stand out​
恵み (megumi)	 blessing; grace​
恵む (megumu)	 to bless; to show mercy to​; to give (money, etc.)​
名簿 (meibo)	 register of names; list of names; roll; register; roster
名物 (meibutsu)	 famous product; special product; speciality; specialty
名産 (meisan)	 noted product; local specialty
名刺 (meishi)	 business card​
明示 (meiji)	 elucidation; explicit statement; specification​
明確 (meikaku)	 clear; precise; definite; distinct​
名門 (meimon)	 noted family; noble family​; prestigious school, organization, business, etc.
明瞭 (meiryou)	 clear; plain; distinct; obvious; evident; articulate
名所 (meisho)	 famous place
目印 (mejirushi)	 mark; sign; landmark; benchmark​
面会 (menkai)	 meeting (face-to-face); interview​
面する (mensuru)	 to face on; to look out on to​
目線 (mesen)	 one’s gaze​; point of view; standpoint​
目覚める (mezameru)	 to wake up; to awake​; to awaken to (instinct, ability, perception, etc.); to become aware of; to become conscious of; to realize​; to come to one’s senses​
未 (mi)	 (prefix) not yet; un-​
見合う (miau)	 to exchange glances​; to correspond; to counterbalance​
身振り手振り (miburiteburi)	 gestures; gesturing​
密着 (micchaku)	 close adhesion; sticking firmly to; being glued to​
道案内 (michiannai)	 guidance; showing the way; guide​; guidepost; signpost; waymark​
導く (michibiku)	 to guide; to lead; to show the way; to conduct​
道のり (michinori)	 distance; journey; itinerary​; path (e.g. to one’s goal); way; process; route; road​
Advertisement
乱れる (midareru)	 to be disordered; to be disarranged; to be disarrayed; to be disheveled; to be dishevelled​
見出し (midashi)	 heading; headline; title; caption​
見張る (miharu)	 to stand watch; to stand guard; to look out​
見直す (minaosu)	 to look at again​; to re-examine; to get a better opinion of; to see in a more positive light​
見慣れる (minareru)	 to become used to seeing; to be familiar with​
民家 (minka)	 private house​
見逃す (minogasu)	 to miss; to overlook; to fail to notice​; to let pass (a matter); to overlook (e.g. a wrongdoing); to turn a blind eye to​
身の回り (mi no mawari)	 one’s personal belongings; one’s vicinity; one’s daily life; everyday necessities​
民族 (minzoku)	 people; race; nation; ethnic group; ethnos​
密閉 (mippei)	 shutting tightly; sealing something airtight​
密接 (missetsu)	 close (relationship, connection, etc.); intimate; near​; close (together)​
満たす (mitasu)	 to satisfy (conditions, one’s appetite, etc.); to meet (e.g. demands); to fulfill; to gratify​
見通し (mitooshi)	 unobstructed view; perspective; visibility; vista​; forecast; outlook; prospect; prediction​; insight; foresight​
見積書 (mitsumorisho)	 written estimate; quotation; quote​
見積もる (mitsumoru)	 to estimate​
見分ける (miwakeru)	 to distinguish; to recognize; to recognise; to tell apart; to differentiate (both figuratively and visually)​
見渡す (miwatasu)	 to look out over; to survey (scene); to take an extensive view of​
溝 (mizo)	 ditch; drain; gutter; trench​; groove; tread​; gap (between people, countries, etc.); gulf​
持ち出す (mochidasu)	 to take out; to carry out; to bring out from where it belongs​; to mention something; to broach a topic; to bring up (a subject)
持ち込む (mochikomu)	 to take something into …; to bring in; to carry in​
持ち主 (mochinushi)	 owner; proprietor; possessor (e.g. of talent, beauty, etc.)​
潜る (moguru)	 to dive (into or under water)​; to get under; to get into; to get in; to creep into; to crawl under; to bury oneself; to burrow into; to dig oneself into; to snuggle under​
模範 (mohan)	 exemplar; model; example; pattern​
模型 (mokei)	 model; dummy; maquette​
木製 (mokusei)	 wooden; made of wood​
目的地 (mokutekichi)	 place of destination​
木材 (mokuzai)	 lumber; timber; wood​
問題点 (mondaiten)	 the problem (at issue); the point at issue; problematic issue; problem
物真似 (monomane)	 mimicry; imitation (of someone, something)​
物足りない (monotarinai)	 unsatisfied; unsatisfactory; insufficient​
盛り上がる (moriagaru)	 to swell; to rise; to bulge; to be piled up​; to rouse; to get excited​
もったいない	 wasteful; a waste​; impious; profane; sacrilegious​; too good; more than one deserves; unworthy of​
猛 (mou)	 (prefix)	 extreme; severe​
催し (moyooshi)	 event; festivities; function; social gathering; auspices; opening; holding (a meeting)​
最寄り (moyori)	 nearest; neighboring; nearby​
無 (mu/bu)	 (prefix) un-; non-​
無縁 (muen)	 unrelated; irrelevant; indifferent​; without relations (esp. of a deceased person); having no surviving relatives​cho
無限 (mugen)	 infinity; infinitude; eternity​; infinite; limitless​
無意識 (muishiki)	 unconsciousness; unconscious; involuntary; automatic; mechanical; unintentional; spontaneous​
無条件 (mujouken)	 unconditional
矛盾 (mujun)	 contradiction; inconsistency​
無関係 (mukankei)	 unrelated
無関心 (mukanshin)	 apathetic; indifferent​
昔話 (mukashibanashi)	 old tale; folk tale; legend​; reminiscence
むかつく	 to feel irritated; to feel offended; to feel angry​; to feel sick; to feel nauseous
向き合う (mukiau)	 to be opposite; to face each other​; to confront (an issue); to face​
無口 (mukuchi)	 taciturn; reticent; quiet; silent; untalkative​
無給 (mukyuu)	 unpaid; nonsalaried​
無線 (musen)	 radio (communication)​; wireless; not using wires
蒸し暑い (mushiatsui)	 humid; sultry​
結びつく (musubitsuku)	 to be related; to be connected; to be joined together​; to result in; to lead to; to bring about​
無数 (musuu)	 innumerable; countless; numberless​
傾らか (nadaraka)	 gently sloping; gentle; easy​; smooth
長続き (nagatsuzuki)	 lasting long; continuation; keeping at (something); sticking to (something)​
嘆く (nageku)	 to lament; to grieve; to regret​; to deplore​
和やか (nagoyaka)	 mild; calm; gentle; quiet; congenial; amicable; amiable; friendly; genial; harmonious; peaceful​
内 (nai)	 (suffix) inside; within
内部 (naibu)	 interior; inside; internal​
内包 (naihou)	 connotation; comprehension; intension​; inclusion; containment within​
内線 (naisen)	 phone extension; indoor wiring; inner line​
中庭 (nakaniwa)	 courtyard; quadrangle; middle court​
生中継 (namachuukei)	 live broadcast (radio, TV); live coverage​
滑らか (nameraka)	 smooth (of a surface); glassy; velvety; soft​
何度も (nandomo)	 many times over; often​
軟弱 (nanjaku)	 weakness
何らか (nanraka)	 some; any; in any way; of some kind; of some sort​
慣れ (nare)	 practice; practising; experience​
成り立つ (naritatsu)	 to consist of; to be made up of; to be composed of​; to be concluded
成し遂げる (nashitogeru)	 to accomplish; to finish; to fulfill​
悩み (nayami)	 trouble; troubles; worry; distress; sorrows; anguish; agony; problem​
名づける (nazukeru)	 to name; to call; to christen; to term​
値上がり (neagari)	 price advance; increase in value​
値引き (nebiki)	 price reduction; discount​
根っこ (nekko)	 root (of a plant)​; stump (of a tree)​; root (of a problem, etc.); base; foundation; origin; source​
寝転がる (nekorogaru)	 to lie down; to throw oneself down
年度 (nendo)	 fiscal year (usu. April 1 to March 31 in Japan); financial year​; academic year; school year​
年金 (nenkin)	 annuity; pension​
年内 (nennai)	 by the end of the year​
狙う (nerau)	 to aim at​; to be after (something); to have an eye on​
熱する (nessuru)	 to heat up; to heat
根強い (nezuyoi)	 firmly rooted; deep-seated​
鈍い (nibui)	 dull (e.g. a knife); blunt​; thickheaded; obtuse; stupid​
日用品 (nichiyouhin)	 daily necessities​
濁る (nigoru)	 to become muddy; to become cloudy; to get impure (of a liquid, gas, etc.)​
日課 (nikka)	 daily lesson; daily work; daily routine​
憎い (nikui)	 hateful; abominable; poor-looking; detestable​
憎しみ (nikushimi)	 hatred
認識 (ninshiki)	 recognition; awareness; perception; understanding; knowledge; cognition; cognizance; cognisance​
偽物 (nisemono)	 spurious article; forgery; counterfeit; imitation; sham
日数 (nissuu)	 a number of days​
荷造り (nizukuri)	 packing; baling; crating​
乗り越える (norikoeru)	 to climb over; to get over; to ride across​; to overcome; to surpass; to overtake​
乗り継ぐ (noritsugu)	 to connect (with a different flight, train, etc.); to make a connection; to change (planes, trains, etc.)​
農園 (nouen)	 plantation
納品 (nouhin)	 delivery of goods​
濃厚 (nouko)	 rich (in flavor, color, smell, etc.); thick; dense; strong
能率 (nouritsu)	 efficiency
農作物 (nousakubutsu)	 crops; agricultural produce​
農薬 (nouyaku)	 agricultural chemical (i.e. pesticide, herbicide, fungicide, etc.); agrochemical; agrichemical​
覗く (nozoku)	 to peek (through a keyhole, gap, etc.)​; to sneak a look at; to take a quick look at​r
入会 (nyuukai)	 admission; joining; enrollment; enrolment​
入会金 (nyuukaikin)	 initiation fee; admission fee​
入金 (nyuukin)	 deposit; payment; money received; money due​
入居 (nyuukyo)	 moving into (house)​
入居者 (nyuukyosha)	 tenant (esp. residential tenant in apartment block); occupant; inhabitant; inmate​
入門 (nyuumon)	 entering an institution; beginning training​; primer; manual; introduction (to)​
乳製品 (nyuuseihin)	 dairy products​
覚え書き (oboegaki)	 memo; memorandum; note​
落ち込む (ochikomu)	 to feel down; to feel sad; to be depressed; to be in low spirits​; to be in a slump (business, economy, etc.); to be in an unfavourable condition​
驚き (odoroki)	 surprise; astonishment; wonder; amazement​
補う (oginau)	 to compensate for; to supplement​
追い返す (oikaesu)	 to drive away; to turn away; to send away; to repel; to repulse​
追い求める (oimotomeru)	 to pursue​
追い越す (oikosu)	 to pass (e.g. car); to overtake​; to surpass; to outstrip; to get ahead of; to outdistance​
追い抜く (oinuku)	 to pass (a car); to overtake; to surpass; to outstrip; to outdistance; to outsail
おかしな	 ridiculous; odd
臆病 (okubyou)	 cowardly; timid; easily frightened​
屋外 (okugai)	 outdoors; alfresco​
遅れ (okure)	 delay; lag; postponement; falling behind​
奥底 (okusoko)	 depths; bottom (of one’s heart)​
思いがけない (omoigakenai)	 unexpected; contrary to expectations; by chance; casual​
思い返す (omoikaesu)	 to re-think; to think back upon; to change one’s mind
思い切り (omoikiri)	 with all one’s strength; with all one’s heart; to the utmost​; resolution; decisiveness​
思い込み (omoikomi)	 wrong impression; subjective impression; assumption; prejudice​
思い立つ (omoitatsu)	 to set one’s mind on doing; to get the idea of doing; to make up one’s mind​
思いつき (omoitsuki)	 plan; idea; suggestion​
思いつく (omoitsuku)	 to think of; to hit upon; to come into one’s mind; to be struck with an idea​; to remember; to recall​
思い浮かぶ (omoiukabu)	 to occur to; to remind of; to come to mind​
重苦しい (omokurushii)	 heavy; gloomy; awkward; cumbrous; oppressive; leaden​
重み (omomi)	 weight
お似合い (oniai)	 well-matched (esp. of a couple); becoming; suitable​
恩恵 (onkei)	 grace; favor; favour; blessing; benefit​
温厚 (onkou)	 gentle; mild-mannered​
音量 (onryou)	 volume (sound)​
大通り (oodoori)	 main street
大げさ (oogesa)	 grandiose; exaggerated​
大声 (oogoe)	 loud voice
大幅 (oohaba)	 big; large; drastic; substantial​
多く (ooku)	 many; much; largely; abundantly; mostly​
多目に (oome ni)	 plenty; lots
大手 (oote)	 major company; big company​
折り返し (orikaeshi)	 by return; (call or write back) without delay​
折り畳む (oritatamu)	 to fold up; to fold into layers​
収まる (osamaru)	 to fit into (a box, frame, category, etc.); to be contained within; to fall within (e.g. a budget)​
納める (osameru)	 to dedicate; to make an offering; to pay (fees)​
おしゃれ	 smartly dressed; stylish; fashion-conscious​; someone smartly dressed​; to dress up; to be fashionable
惜しい (oshii)	 regrettable; disappointing; unfortunate​; precious; dear; valuable​
押し付ける (oshitsukeru)	 to press; to push; to force​; to foist on (task, responsibility); to impose (one’s will)​
教わる (osowaru)	 to be taught (by); to learn from​
お勧め (osusume)	 recommendation; advice; suggestion; encouragement​
お手本 (otehon)	 example; role model
お手数 (otesuu)	 trouble; bother​
お得 (otoku)	 economical; bargain; good value; good-value​
大人しい (otonashii)	 obedient; docile; quiet​
訪れる (otozureru)	 to visit; to call on​; to arrive; to come; to appear​
欧米 (oubei)	 Europe and America; the West​
応募者 (oubosha)	 applicant
応答 (outou)	 reply; answer; response​
親子 (oyako)	 parent and child​
および	 and; as well as​
来日 (rainichi)	 arrival in Japan; coming to Japan; visit to Japan​
来学期 (raigakki)	 next semester
来場 (raijou)	 attendance
来場者 (raijousha)	 those attending​
来年度 (rainendo)	 next year; next fiscal year​
来店 (raiten)	 coming to a store (restaurant, bar, shop, etc.)​
来店者 (raitensha)	 visitor (to a shop or restaurant); customer (visiting a store or restaurant); patron​
楽観 (rakkan)	 optimism; taking an optimistic view​
欄 (ran)	 section (e.g. in a newspaper); column; page​; field (in a form, web page, etc.); blank​
乱暴 (ranbou)	 violence; assault; running riot​; rough (e.g. handling); reckless; careless; coarse; rude; unreasonable (e.g. demand); wild (e.g. argument)​
冷房 (reibou)	 cooling; air-conditioning​
例外 (reigai)	 exception
礼儀作法 (reigisahou)	 etiquette; courtesy​
冷水 (reisui)	 cold water​
恋愛 (ren’ai)	 love; love-making; passion; emotion; affections​
連休 (renkyuu)	 consecutive holidays​
理解力 (rikairyoku)	 (power of) understanding; comprehensive faculty​
理系 (rikei)	 science
陸上 (rikujou)	 (on) land; ground; shore
裏面 (rimen)	 back; reverse; other side; inside; tails (of coins); background​
臨時 (rinji)	 temporary; provisional; interim​; special; extraordinary; extra​
履歴書 (rirekisho)	 personal history; curriculum vitae; resume​
立食 (risshoku)	 stand-up meal; buffet​
利点 (riten)	 advantage; point in favor
論戦 (ronsen)	 verbal dispute​
労働力 (roudouryoku)	 labor; manpower; working force​
略す (ryakusu)	 to abbreviate; to omit; to abbreviate; to omit
力 (ryoku)	 (suffix) strength; power; proficiency; ability​
寮 (ryou)	 hostel; dormitory​
領域 (ryouiki)	 area; domain; territory; field; range; region; regime​
了解 (ryoukai)	 comprehension; consent; understanding; agreement​
緑茶 (ryokucha)	 green tea; Japanese tea​
両面 (ryoumen)	 both sides; two sides; double-sided​
両者 (ryousha)	 pair; the two; both persons; both things​
了承 (ryoushou)	 acknowledgement; acknowledgment; understanding (e.g. “please be understanding of the mess during our renovation”); noting; acceptance
両端 (ryoutan)	 both ends; either end; both edges​; double-mindedness; sitting on the fence​
流  (ryuu)	 (suffix) fashion; way; style; manner​; class; rank; rate​
定める (sadameru)	 to decide; to determine​; to establish; to lay down; to prescribe; to provide; to stipulate​; to bring peace (to); to make peaceful​
探る (saguru)	 to feel around for; to fumble for; to grope for; to search for; to look for​; to investigate; to probe into; to spy on; to sound out​
再 (sai)	 (prefix) re-; again; repeated; deutero-; deuto-; deuter-​
最悪 (saiaku)	 worst; horrible; horrid; awful; terrible​
栽培 (saibai)	 cultivation
最大 (saidai)	 biggest; greatest; largest; maximum
再度 (saido)	 twice; again; second time​
災害 (saigai)	 calamity; disaster; misfortune​
再発 (saihatsu)	 return; relapse; reoccurrence​
再開 (saikai)	 reopening; resumption; restarting​
細菌 (saikin)	 bacterium; bacteria; germ​
最高齢 (saikourei)	 oldest; most advanced age​
再生 (saisei)	 resuscitation; regeneration; restoration to life​; reformation; rehabilitation​; playback; regeneration (sound, etc.); view (of a video clip)​
最新 (saishin)	 latest; newest; late-breaking (news)​
最小限 (saishougen)	 minimum; lowest​
採集 (saishuu)	 collecting; gathering​
最終日 (saishuubi)	 last day; final day
最速 (saisoku)	 fastest
催促 (saisoku)	 pressing; urging; demanding; demand​
最低限 (saiteigen)	 minimum; at the very least​
最適 (saiteki)	 most suitable; optimum; optimal; best​
採用 (saiyou)	 use; adoption; acceptance​; appointment; employment; engagement; recruitment​
坂道 (sakamichi)	 hill road
遡る (sakanoboru)	 to go upstream; to go back (in time, to origin); to date back to; to trace back to; to make retroactive
先々 (sakizaki)	 distant future; inevitable future​; places one goes to​
早急 (sakkyuu)	 immediate; prompt; quick; rapid; urgent; pressing​
作成 (sakusei)	 drawing up (e.g. legal document, contract, will, etc.); preparing; writing; framing; making; producing; creating; creation
妨げる (samatageru)	 to disturb; to prevent; to obstruct; to hinder​
山頂 (sanchou)	 summit (of a mountain)​
参観 (sankan)	 visit; inspection​
参照 (sanshou)	 reference; bibliographical reference; consultation; browsing (e.g. when selecting a file to upload on a computer); checking out​
皿洗い (saraarai)	 washing-up; dish-washing​
さらさら	 rustling; murmuring; fluently; silky; smooth and dry; free-flowing​
猿真似 (sarumane)	 indiscriminate imitation; monkey see, monkey do; blind follower
細やか (sasayaka)	 meagre; meager; modest
ささやく	 to whisper; to murmur​​
差し出す (sashidasu)	 to present; to submit; to tender; to hold out​
差し引く (sashihiku)	 to deduct; to take away; to dock​; to make allowances for something; to bear something in mind
差し支える (sashitsukaeru)	 to interfere; to hinder; to become impeded​
さっさ	 promptly; immediately; quickly; without delay​
早速 (sassoku)	 at once; immediately; without delay; promptly​
撮影 (satsuei)	 photography (still or motion); photographing; filming; shooting; (video) recording​
刺す (sasu)	 to pierce; to stab; to prick; to stick; to thrust​; to sting; to bite
さわやか	 fresh; refreshing; invigorating​
狭める (sebameru)	 to narrow; to reduce; to contract​
接着 (secchaku)	 adhesion; glueing; gluing; bonding; binding; adhering; fastening​
設置 (secchi)	 establishment; institution​; installation (of a machine or equipment)​
制 (sei)	 (suffix) system; organization; organisation; imperial command; laws; regulation; control; government; suppression; restraint; holding back; establishment​
整備 (seibi)	 maintenance; servicing​; putting in place; establishment; development; preparation; provision; outfitting​
成分 (seibun)	 ingredient; component; composition​
声援 (seien)	 (shout of) encouragement; cheering; rooting; support​
精一杯 (seiippai)	 the best one can do; one’s best effort​; with all one’s might; to the best of one’s ability​
成果 (seika)​	 (good) result; outcome; fruits (of one’s labors); product; accomplishment​
生計 (seikei)	 livelihood; living​
正門 (seimon)	 main gate; main entrance​
製作 (seisaku)	 manufacture; production​
制作 (seisaku)	 work (film, book)​; production; creation; turning (something) out; development​
政策 (seisaku)	 political measures; policy​
清算 (seisan)	 settlement (financial); squaring accounts; clearing debts​; liquidation; ending (a relationship); breaking up (with); burying (the past); redeeming (one’s faults)​
精神力 (seishinryoku)	 emotional strength; force of will​
性質 (seishitsu)	 nature; property; disposition​
清掃 (seisou)	 cleaning; clean-up; garbage collection; scavenging​
生得的 (seitokuteki)	 innate; inherent; natural; inborn​
生命力 (seimeiryoku)	 vitality; (one’s) life force​
性能 (seinou)	 ability; performance; efficiency​
成立 (seiritsu)	 formation; establishment; materialization; coming into existence​; conclusion (e.g. of a deal); approval; completion; arrangement​
生産者 (seisansha)	 manufacturer; producer​
政党 (seitou)	 political party​
設計者 (sekkeisha)	 designer
設計図 (sekkeizu)	 plan; blueprint​
説教 (sekkyou)	 remonstration; scolding; lecturing​
選抜 (senbatsu)	 selection; choice; picking out​
選別 (senbetsu)	 selection; classification; sorting; screening; triage​
先着 (senchaku)	 arriving first​
戦後 (sengo)	 postwar period; period after Second World War​
専業主婦 (sengyoushufu)	 housewife
選考 (senkou)	 selection; screening​
選挙 (senkyo)	 election
鮮明 (senmei)	 vivid; clear; distinct​
専門書 (senmonsho)	 technical book; specialized book; treatise​
専門店 (senmonten)	 specialist shop; shop specializing in a few types of product​
専念 (sennen)	 absorption; giving undivided attention; devoting oneself (to)​
洗練 (senren)	 polish; refinement​
線路 (senro)	 railway track; railway line; railroad; railway; track; line
戦略 (senryaku)	 strategy; tactics​
先先週 (sensenshuu)	 week before last​
洗濯機 (sentakuki)	 washing machine (laundry)​
洗剤 (senzai)	 detergent; cleanser; cleaning agent; washing material​
接する (sessuru)	 to touch; to come in contact with; to border on; to adjoin; to be adjacent; to be close​; to receive (e.g. visitor); to attend to; to serve; to take care of; to look after; to deal with; to see​
選出 (senshutsu)	 election; selection; choice​
選択肢 (sentakushi)	 choices; alternatives; options​
先端 (sentan)	 pointed end; tip; point; forefront; vanguard; spearhead; leading edge​
接続 (setsuzoku)	 connection; attachment; union; join; joint; link
専用 (sen’you)	 exclusive use; personal use; dedicated​
専属 (senzoku)	 exclusive; attached to; specialist​
