一気に (ikki ni)	 in one go; in one gulp; in one breath; without stopping; without pausing; without resting; in one sitting; at a stretch; all at once​
一向に (ikkou ni)	 completely; absolutely; totally​; (not) at all; (not) a bit; (not) in the least​; earnestly; intently; determinedly​
移行 (ikou)	 switching over to; migration; transition​
育児 (ikuji)	 childcare; child-rearing; nursing; upbringing​
育成 (ikusei)	 rearing; training; nurture; cultivation; promotion​
いまいち	 not quite (right); not very good; somewhat (lacking)​
印鑑 (inkan)	 stamp; seal​
飲料水 (inryousui)	 drinking water​
印刷物 (insatsubutsu)	 printed matter​
飲食店 (inshokuten)	 restaurant
一方的 (ippouteki)	 one-sided; unilateral; arbitrary​
入れ込む (irekomu)	 to put in; to place inside; to push into; to stuff into​; to be enthusiastic; to be engrossed​
入り替える (irikaeru)	 to replace; to substitute; to shift; to change places
衣装 (ishou)	 clothing; costume; outfit; garment; dress
急ぎ (isogi)	 haste; hurry; expedition; speed; dispatch​
一斉に (issei ni)	 simultaneously; all at once; in unison​
傷む (itamu)	 to be spoiled (e.g. food); to be damaged​
意図 (ito)	 intention; aim; design​
嫌々 (iyaiya)	 unwillingly; grudgingly; reluctantly​
意欲 (iyoku)	 will; desire; ambition; urge (e.g. creative urge)​
痛ましい (itamashii)	 pitiful; heartbreaking; heartrending; touching; tragic; sad; hurtful​
痛める (itameru)	 to hurt; to injure; to cause pain​; to harm; to damage; to spoil
一斉に (issei ni)	 simultaneously; all at once; in unison​
一色 (isshoku)	 same tendency; everyone being caught up in the same thing​; one color
移転 (iten)	 moving; relocation; change of address​; transfer (of deeds, property, etc.); demise​
一旦 (ittan)	 once; for a short time; briefly; temporarily
一定 (ittei)	 fixed; settled; constant; definite; uniform; regularized; regularised; defined; standardized; standardised; certain; prescribed​
一転 (itten)	 complete change; reversal; sudden transformation​
居酒屋 (izakaya)	 izakaya; Japanese bar that also serves various dishes and snacks​
依然 (izen)	 still; as yet; as it has been
事物 (jibutsu)	 things; affairs​
実地 (jicchi)	 practice (as opposed to theory); actual practice​; actual site; (at) the scene; (on) the spot​
自治体 (jichitai)	 municipality; local government; self-governing body; autonomous body​
児童 (jidou)	 children; juvenile​
次回 (jikai)	 next time (occasion)​
事業 (jigyou)	 project; enterprise; business; industry; operations; venture; service​
時事 (jiji)	 events of the day; current affairs​
次回 (jikai)	 next time (occasion)​
時間帯 (jikantai)	 period of time; time slot; time zone​
自覚 (jikaku)	 self-consciousness; self-awareness​
実感 (jikkan)	 real feeling; actual feeling​
実験者 (jikkensha)	 experimenter; researcher​
じっくり	 deliberately; carefully; thoroughly; without rushing​
自己 (jiko)	 self; oneself​
時給 (jikyuu)	 hourly pay; hourly wage​
地元 (jimoto)	 home area; home town​; local
人工物 (jinkoubutsu)	 artificial object; man-made object; artifact; artefact​
人工知能 (jinkouchinou)	 artificial intelligence; AI
人材 (jinzai)	 capable person; talented person​; human resources; personnel​
事例 (jirei)	 example; precedent; case​
自律 (jiritsu)	 autonomy (philosophy)​; self-control​
持参 (jisan)	 bringing; taking; carrying​
自社 (jisha)	 one’s company; company one works for​
実質 (jisshitsu)	 substance; essence​; real (in economics, vs. nominal, e.g. real interest rate); substantive; substantial; essential; tangible​
自主 (jishu)	 independence; autonomy; self-reliance​
自習 (jishuu)	 self-study; teaching oneself
実績 (jisseki)	 achievements; actual results; accomplishments; past results; track record​
実践 (jissen)	 practice; putting into practice; implementation​
実施 (jisshi)	 enforcement; implementation; putting into practice; carrying out; operation; working (e.g. working parameters); enactment​
自体 (jitai)	 itself
辞退 (jitai)	 declining; refusal; nonacceptance; turning down; withdrawal (e.g. of candidacy); pulling out (e.g. of a race); excusing oneself​
時点 (jiten)	 point in time; occasion​
事典 (jiten)	 encyclopedia; cyclopedia​
事前 (jizen)	 prior; beforehand; in advance; before the fact; ex ante
慈善 (jizen)	 charity; philanthropy​
持続 (jizoku)	 continuation; persisting; lasting; sustaining; enduring
じたばた	 (kicking and) struggling; wriggling; floundering​
序列 (joretsu)	 rank; ranking order; hierarchy​
助手席 (joshuseki)	 passenger seat; assistant driver’s seat​
上部 (joubu)	 top part; surface​
上半身 (jouhanshin)	 upper half of (one’s) body; upper body; bust
蒸発 (jouhatsu)	 evaporation; disappearance (of people intentionally concealing their whereabouts); unexplained disappearance​
上位 (joui)	 superior (in rank); top; ranking​
情景 (joukei)	 spectacle; sight; scene​
上級者 (joukyuusha)	 advanced student; advanced learner; advanced practitioner; experienced person​
常温 (jouon)	 normal temperature; room temperature​
上陸 (jouriku)	 landing; disembarkation; landfall​
乗車 (jousha)	 boarding (a train, bus, etc.); getting into (e.g. a taxi)​
上司 (joushi)	 (one’s) superior; (one’s) boss; the higher-ups​
上昇 (joushou)	 rising; ascending; climbing​
錠剤 (jouzai)	 pill; lozenge; tablet​
受動的 (judouteki)	 passive
受験生 (jukensei)	 student preparing for or taking examinations (usu. entrance exams); test-taker​
受講 (jukou)	 taking (attending) lectures​
塾 (juku)	 coaching school; cramming school; juku​
寿命 (jumyou)	 life span​
順位 (jun’i)	 order; rank; position (e.g. in a race); precedence​
循環 (junkan)	 circulation; rotation; cycle; loop​
順に (jun ni)	 in order; in turn; one by one​
順序 (junjo)	 order; sequence; procedure​
順応 (junnou)	 adaptation; accommodation; conforming; adjustment​; acclimatization
純粋 (junsui)	 pure; true; genuine; unmixed​
受診 (jushin)	 having a medical examination; seeing a doctor​
受賞 (jushou)	 winning (a prize)​
充電 (juuden)	 charging (electrically)​
充実感 (juujitsukan)	 sense of fulfillment; sense of completeness; sense of accomplishment; sense of contentment​
充満 (juuman)	 being filled with; being full of; permeation​
柔軟 (juunan)	 flexible; lithe; soft; pliable​
充実 (juujitsu)	 fullness; completion; perfection; enhancement; improvement; enrichment; upgrading​
充実感 (juujitsukan)	 sense of fulfillment; sense of completeness; sense of accomplishment; sense of contentment​
住宅地 (juutakuchi)	 housing district; residential district​
重役 (juuyaku)	 (company) director; executive; top management​; important post; role with heavy responsibilities​
課 (ka)	 lesson; section (in an organization); division; department​; counter for lessons and chapters (of a book)​
価値観 (kachikan)	 sense of values; values; value system​
課題 (kadai)	 subject; theme; issue; matter​; homework; assignment​; task; challenge; problem; question​
過度 (kado)	 excessive; immoderate​
花粉 (kafun)	 pollen
花粉症 (kafunshou)	 hay fever; pollinosis (allergy to pollen)​
輝かしい (kagayakashii)	 brilliant; glorious; glittering; bright; splendid (e.g. achievement, success); promising (e.g. future)​
輝き (kagayaki)	 brightness; brilliance; brilliancy; radiance; glitter​
過激 (kageki)	 extreme; radical​
限り (kagiri)	 limit; limits; bounds​; degree; extent; scope​
限りない (kagirinai)	 eternal; unlimited; endless​
嗅ぐ (kagu)	 to sniff; to smell​
下位 (kai)	 low rank; lower position; subordinate position; lower order (e.g. byte)​
開封 (kaifuu)	 opening (an envelope or parcel); breaking the seal; unsealed letter​
介護 (kaigo)	 nursing; care; caregiving; caring​
介護施設 (kaigoshisetsu)	 nursing home; rest home
開発 (kaihatsu)	 development; exploitation​
解放 (kaihou)	 release; unleashing; liberation; emancipation; setting free​
開放感 (kaihoukan)	 sense of space; spaciousness​
会員証 (kaiinshou)	 membership card; membership certificate​
開会 (kaikai)	 opening of a meeting​
会見 (kaiken)	 interview; audience; meeting; (viewing) party
解決策 (kaiketsusaku)	 solution; solution strategy​
開幕 (kaimaku)	 raising the curtain​; opening (of an event); start of a season
皆無 (kaimu)	 nonexistent; nil; none; nothing (at all); bugger-all​
飼い主 (kainushi)	 shepherd; (pet) owner​
回覧 (kairan)	 circulation (esp. documents); sending round​
改良 (kairyou)	 improvement; reform​
開催 (kaisai)	 holding (a conference, exhibition, etc.); opening; hosting (e.g. the Olympics)​
解散 (kaisan)	 breaking up (e.g. meeting); dispersing (e.g. crowd)​; dissolving (company, organization, etc.); liquidating; disbanding​
改正 (kaisei)	 revision; amendment; alteration​
開設 (kaisetsu)	 establishment; opening; setting up; inauguration​
解説 (kaisetsu)	 explanation; commentary; exposition; elucidation​
買い占める (kaishimeru)	 to buy up​
解消 (kaishou)	 cancellation; liquidation; resolution; reduction (e.g. of stress)​
海水浴 (kaisuiyoku)	 swimming in the ocean; sea bathing; seawater bath; going for a dip in the ocean​
回数 (kaisuu)	 number of times; frequency; count
改訂 (kaitei)	 revision (of text); alteration; change
回転 (kaiten)	 rotation (usu. around something); revolution; turning​
開店 (kaiten)	 opening a new shop​; opening a shop (for the day)​
回答 (kaitou)	 reply; answer​
解約 (kaiyaku)	 cancellation of contract​
果実 (kajitsu)	 fruit; nut; berry​; profit
過剰 (kajou)	 excess; surplus; superabundance; overabundance​
係 (kakari)	 charge; duty; person in charge; official; clerk
欠かせない (kakasenai)	 indispensable; vital; fundamental; imperative; crucial
欠かす (kakasu)	 to miss (doing); to fail (to do)​
関わり合う (kakawariau)	 to get involved or entangled in; to get mixed up in; to have something to do with; to have dealings with​
下記 (kaki)	 the following
夏期 (kaki)	 summer term (e.g. school); summer period​
格好つける (kakkou tsukeru)	 to affect a stylish air; to try to look good; to show off​
隔 (kaku)	 every other; second; alternate​
格別 (kakubetsu)	 particular; special; exceptional; especial​
角度 (kakudo)	 angle
確保 (kakuho)	 securing; obtaining; ensuring; guarantee; maintaining​
各位 (kakui)	 everyone; each and every one (of you); ladies and gentlemen​
各自 (kakuji)	 each (person); everyone; individual; respective​
確率 (kakuritsu)	 probability; likelihood; chances​
獲得 (kakutoku)	 acquisition; possession​
格安 (kakuyasu)	 cheap; reasonable
歓迎会 (kangeikai)	 welcome party
活発 (kappatsu)	 lively; active; vigorous; animated; brisk​
係 (kakari)	 charge; duty; person in charge; official; clerk​
係員 (kakariin)	 person in charge; official; attendant​
駆け抜ける (kakenukeru)	 to run past from behind; to run through (e.g. gate, one’s mind)​
拡充 (kakujuu)	 expansion
確信 (kakushin)	 conviction; belief; confidence​
確定 (kakutei)	 decision; settlement​
感 (kan)	 (prefix) feeling; sensation; emotion; admiration; impression​
叶う (kanau)	 to come true (of a wish, prayer, etc.); to be realized; to be fulfilled; to suit (e.g. a purpose); to meet (wishes, ideals, etc.); to conform to (standards, rules, etc.); to be consistent with​
完備 (kanbi)	 (being) fully equipped; (being) fully furnished
勘違い (kanchigai)	 misunderstanding; mistaken idea; wrong guess​
加熱 (kanetsu)	 heating; application of heat​
看護 (kango)	 nursing; (army) nurse​
看護師 (kangoshi)	 (hospital) nurse; registered nurse​
感じ取る (kanjitoru)	 to perceive; to sense; to take in; to grasp; to feel​
簡潔 (kanketsu)	 brevity; conciseness; simplicity​
観光地 (kankouchi)	 tourist attraction; sight-seeing area​
観念 (kannen)	 idea; notion; concept; conception​; sense (e.g. of duty)​
完璧 (kanpeki)	 perfect; complete; flawless​
簡略 (kanryaku)	 simple; simplicity; brief; brevity​
簡略化 (kanryakuka)	 simplification
観戦 (kansen)	 watching a (sports) game; spectating; observing (military operations)​
観測 (kansoku)	 observation; survey; measurement​
鑑賞 (kanshou)	 appreciation (of art, music, poetry, etc.)​
観点 (kanten)	 point of view​
勧誘 (kan’yuu)	 invitation; solicitation; canvassing; canvasing; inducement; persuasion; encouragement​
絡む (karamu)	 to entangle; to entwine​; to pick a quarrel; to find fault​
仮に (kari ni)	 supposing; even if; granting that; for argument’s sake; temporarily; provisionally; for the time being​
軽々 (karugaru)	 lightly; easily; carelessly​
重なる (kasanaru)	 to be piled up; to lie on top of one another​; to come one after another; to happen over and over; to pile up (e.g. stress); to accumulate
歌詞 (kashi)	 song lyrics; words of a song; libretto​
貸し出し (kashidashi)	 lending; loaning
箇所 (kasho)	 passage; place; point; part
加速 (kasoku)	 acceleration; speeding up​
かすか	 faint; dim; weak; slight; vague; indistinct; hazy​; poor; wretched; meagre; meager; scanty
課する (kasuru)	 to levy; to charge; to assess; to impose; to assign​
肩幅 (katahaba)	 shoulder width (breadth)​
傾く (katamuku)	 to incline toward; to slant; to lurch; to heel over; to be disposed to; to trend toward; to be prone to​
語りかける (katarikakeru)	 to make a speech; to address​
偏る (katayoru)	 to lean (to one side); to incline​; to be unbalanced (e.g. diet); to be unduly weighted towards; to be concentrated on​; to be partial; to be biased; to be prejudiced​
片付け (katazuke)	 tidying up; finishing
片付く (katazuku)	 to be put in order; to be put to rights​; to be disposed of; to be solved​
過程 (katei)	 process; course; mechanism​
下等 (katou)	 inferior; base; vulgar; low grade; lower class​
活字 (katsuji)	 printing type; movable type​; printed text; print​
活力 (katsuryoku)	 vitality; energy; dynamism​
活躍 (katsuyaku)	 activity (esp. energetic); great efforts; conspicuous service​; to flourish; to participate actively; to play an active role​
可愛がる (kawaigaru)	 to love; to cherish; to be affectionate to; to treat tenderly; to dote on​; to show favouritism to; to be partial to​
変わった (kawatta)	 another; different; various; particular; unusual; novel; peculiar
かゆい	 itchy
飾り付け (kazaritsuke)	 decoration; arrangement​
数々 (kazukazu)	 many; numerous; various; large number of​
数多く (kazuooku)	 in great numbers​
決着 (kecchaku)	 conclusion; decision; end; settlement​
気配 (kehai)	 indication; sign; hint; presence; trend​
警備 (keibi)	 defense; defence; guard; policing; security​
警備員 (keibihin)	 guard; security (officer); guardsman​
経営者 (keieisha)	 manager; proprietor​
軽減 (keigen)	 abatement; reduction​
経費 (keihi)	 expenses; cost; outlay​
契機 (keiki)	 opportunity; chance​; trigger; cause​
蛍光灯 (keikoutou)	 fluorescent lamp; fluorescent light​
経理 (keiri)	 accounting; administration (of money)​
掲載 (keisai)	 publication (e.g. of an article in a newspaper); carrying (e.g. a story); running (e.g. a serial); insertion (e.g. of an advertisement); printing; posting (e.g. on the web)​
軽視 (keishi)	 making light of; thinking little of; slighting; belittling; dismissing; contempt; disdain​
形式 (keishiki)	 form (as opposed to substance); formality​
計測 (keisoku)	 measuring; measurement​
携帯 (keitai)	 something carried (in the hand); handheld; portable​; mobile telephone; cell phone​ (abbreviation)
毛糸 (keito)	 knitting wool; woollen yarn​
系統 (keitou)	 system; lineage; ancestry; family line​; group (e.g. of colors) (colours); family (e.g. of languages); party; school (of thought)​
継続 (keizoku)	 continuation
謙虚 (kenkyo)	 modest; humble​
検索 (kensaku)	 looking up (e.g. a word in a dictionary); retrieval (e.g. data); searching for; referring to​
検診 (kenshin)	 physical examination; medical examination; health checkup; health screening​
研修 (kenshuu)	 training (esp. in-service); induction course​
研修会 (kenshuukai)	 workshop; training course​
謙遜 (kenson)	 modesty; humility; being humble​
決勝 (kesshou)	 decision of a contest; finals (in sports)​
決勝戦 (kesshousen)	 championship game; finals (of a tournament); deciding round​
桁 (keta)	 column; beam; girder; crossbeam; spar; yard​; digit; decade; order of magnitude​
決断 (ketsudan)	 decision; determination​
険しい (kewashii)	 precipitous; rugged; inaccessible; impregnable; steep​; grim; severe; stern​
削る (kezuru)	 to shave (wood, leather, etc.); to sharpen (e.g. pencil); to plane; to whittle; to pare; to scrape off; to erode​; to cut down (budget, expenses, staff, time, etc.); to curtail; to reduce​
気が重い (ki ga omoi)	 depressed; bummed out; down; heavy-hearted; heavy-spirited; feeling reluctant (to do)​
気が進まない (ki ga susumanai)	 reluctant to; not inclined to; disinclined; unwilling​
気を落とす (ki o otosu)	 to be discouraged; to be disheartened​
気を使う (ki o tsukau)	 to pay attention to another’s needs; to attend to; to fuss about; to take into consideration​
気を失う (ki o ushinau)	 to lose consciousness; to faint; to black out​
機敏 (kibin)	 clever; shrewd; canny; smart; quick; prompt​
規模 (kibo)	 scale; scope; plan; structure​
気分転換 (kibuntenkan)	 change of pace; change of mood; (mental) break (e.g. going for a walk); refreshment
きっちり	 exactly; precisely; punctually; on the dot; closely; tightly; (fitting) perfectly​; properly; without fail​
気軽 (kigaru)	 carefree; buoyant; lighthearted; sprightly​
器具 (kigu)	 utensil; apparatus; implement; device; gadget​
期日 (kijitsu)	 fixed date; settlement date​
企画 (kikaku)	 planning; project; plan; design​
機器 (kiki)	 device; equipment; machinery; apparatus​
聞き手 (kikite)	 hearer; listener; audience; interviewer; questioner​
聞き取る (kikitoru)	 to catch (a person’s words); to make out; to follow; to understand​
気配り (kikubari)	 care; attentiveness; attention; consideration (for others); solicitude​
決め付ける (kimetsukeru)	 to fix upon (one-sidedly); to (ignore somebody’s position and) arbitrarily decide something is the case​
緊張感 (kinchoukan)	 feeling of tension; air of tension; tension; nervousness
金魚 (kingyo)	 goldfish
勤務 (kinmu)	 service; duty; work​
近年 (kinnen)	 recent years​
近隣 (kinrin)	 neighborhood; vicinity​
絹 (kinu)	 silk
金融 (kinyuu)	 finance; financing; credit transacting; loaning of money; circulation of money​
きっぱり	 clearly; plainly; distinctly
気楽 (kiraku)	 carefree; comfortable; at ease​; easygoing; happy-go-lucky​
切り上げる (kiriageru)	 to close (at a certain point); to cut short; to stop early; to finish (at a convenient spot)​; to round up (number)​
切り取る (kiritoru)	 to cut off; to excise; to tear off; to cut out; to whittle down; to tear out; to cut down; to amputate​
帰省 (kisei)	 homecoming; returning home​
貴社 (kisha)	 your company​ (honorific)
気象 (kishou)	 weather; climate
機種 (kishu)	 type of equipment; model​
競う (kisou)	 to compete; to contend; to vie; to contest​
鍛える (kitaeru)	 to forge; to temper​; to drill; to train; to discipline​
規定 (kitei)	 stipulation; prescription; provision; regulation; rule​
刻み込む (kizamikomu)	 to etch (name, etc.); to carve (design)​
刻む (kizamu)	 to mince; to cut fine; to chop up; to hash; to shred​; to carve; to engrave; to chisel; to notch
傷物 (kizumono)	 defective article; damaged goods​
個別 (kobetsu)	 particular case; discrete; individual; separate
こだわり	 obsession; fixation; hangup; determination; fastidiousness; pickiness about (trait, style, etc.)​; complaining; criticizing​​
拘る (kodawaru)	 to fuss over; to be particular about​
孤独 (kodoku)	 solitude; loneliness; isolation​
古風 (kofuu)	 old-fashioned; archaic; antique; antiquated​
小金 (kogane)	 small sum of money​
小柄 (kogara)	 small build; small stature; petite​
焦げる (kogeru)	 to burn; to scorch; to char; to singe​
個人差 (kojinsa)	 individual differences; personal equation​
個々 (koko)	 individual; one by one; separate​
心地良い (kokochiyoi)	 comfortable; pleasant​
試み (kokoromi)	 attempt; trial; experiment​; endeavour (endeavor); effort; venture; initiative​
心強い (kokorozuyoi)	 heartening; reassuring​
快い (kokoroyoi)	 pleasant; agreeable; comfortable; refreshing​
細やか (komayaka)	 tender; warm; caring; thoughtful​; meticulous; detailed; attentive​
小物 (komono)	 accessories; small articles​
根元/根本 (kongen)	 root; source; origin; foundation; base; principle​
根性 (konjou)	 willpower; guts; determination; grit; spirit​; character; nature; disposition; personality​
根気 (konki)	 patience; perseverance; persistence; tenacity; energy​
今年度 (konnendo)	 this year; this fiscal year; this school year​
好ましい (konomashii)	 nice; likeable; desirable​
この度 (konotabi)	 this occasion; at this time; now​
孤立 (koritsu)	 isolation; being alone; being friendless
個性 (kosei)	 individuality; personality; idiosyncrasy; character; individual characteristic
子育て (kosodate)	 child rearing; child raising; raising children; parenting
応える (kotaeru)	 to respond; to answer; to meet (e.g. demands, expectations)​
個体 (kotai)	 individual; specimen​
固定 (kotei)	 fixing (in place); securing; anchoring; fastening down​; fixing (e.g. salary, capital); keeping the same
古典 (koten)	 classic (work, esp. book); the classics​
言葉遣い (kotobazukai)	 speech; expression; wording; language
事柄 (kotogara)	 matter; thing; affair; circumstance​
こつこつ	 unflaggingly; steadily; untiringly; laboriously​; knocking; tapping; clicking; drumming​
高 (kou)	 (prefix) high
好調 (kouchou)	 favorable; promising; satisfactory; in good shape​
高度 (koudo)	 altitude; height; elevation​; high-degree; high-grade; advanced; sophisticated; strong​
行動力 (koudouryoku)	 ability to take action; energy; fire; dynamism; leverage
公演 (kouen)	 public performance​
校外 (kougai)	 out-of-school; off-campus
公害 (kougai)	 pollution; public nuisance; contamination​
後半 (kouhan)	 second half; latter half​
高品質 (kouhinshitsu)	 high quality
好印象 (kouinshou)	 good impression; favorable impression​
向上 (koujou)	 elevation; rise; improvement; advancement; progress​
恒常 (koujou)	 constancy; permanence
公開 (koukai)	 opening to the public; making available to the public; putting on display; exhibiting; showing (play, movie, etc.); holding (interview, etc.); open; public​
好感 (koukan)	 good feeling; good will; favourable impression; favorable impression​
後期 (kouki)	 latter period; second half; late stage; third trimester; second semester
高級 (koukyuu)	 high class; high grade​; high rank; seniority​
交流会 (koukyuukai)	 gathering; mixer; meetup; assembly; social; exchange meeting​
項目 (koumoku)	 item; heading; category; clause​; headword (in a dictionary, encyclopedia, etc.); entry
高熱 (kounetsu)	 high fever​
光熱費 (kounetsuhi)	 cost of fuel and lighting; cost of heat and electricity; energy bill; utility cost​
好悪 (kouo)	 likes and dislikes​
高齢 (kourei)	 advanced age; old age​
高齢化 (koureika)	 population ageing (aging)​
高齢者 (koureisha)	 old person; old people​
小売 (kouri)	 retail
効率 (kouritsu)	 efficiency
公立 (kouritsu)	 public (institution)​
効力 (kouryoku)	 effect; efficacy; validity; potency​
工作 (kousaku)	 handicraft; work; construction; manufacturing​; maneuvering; manoeuvering​
考察 (kousatsu)	 consideration; inquiry; enquiry; investigation; study​
公正 (kousei)	 justice; fairness; impartiality​
光線 (kousen)	 beam; light ray
講師 (koushi)	 lecturer
更新 (koushin)	 renewal; update; innovation; improvement​
公衆 (koushuu)	 the public; general public​
高層 (kousou)	 multistory; multistoried; high-rise; high; tall​
香水 (kousui)	 perfume
交代 (koutai)	 alternation; change; relief; relay; shift; substitution (sports, etc.); taking turns​
肯定 (koutei)	 affirmation
紅葉 (kouyou)	 autumn colours; fall colors; leaves changing color
効用 (kouyou)	 use; utility; effect; benefit​
口座 (kouza)	 account (e.g. bank)​
講座 (kouza)	 course (e.g. of lectures)​; academic teaching unit; lectureship; professorial chair​
構造 (kouzou)	 structure; construction; makeup; framework; organization; pattern​
小遣い (kozukai)	 pocket money; spending money; pin money; allowance
怖がる (kowagaru)	 to be afraid of; to fear; to dread; to be nervous (about); to be shy (of)​
苦 (ku)	 pain; anguish; suffering; distress; anxiety; worry; trouble; difficulty; hardship
砕く (kudaku)	 to break, to smash
くどい	 verbose; importunate; wordy; repetitious; long-winded; heavy (taste); rich; strong; cloying; gaudy; loud
区切り (kugiri)	 punctuation; pause; juncture​; end; (place to) stop​
苦情 (kujou)	 complaint; troubles; objection; grievance​
組み替える (kumikaeru)	 to rearrange (classes); to recompose; to reset; to recombine (genes)​
組み込む (kumikomu)	 to insert; to include; to incorporate; to cut in (printing)​
暗闇 (kurayami)	 darkness; the dark​
