暴れる (abareru)	 to act violently; to rage; to struggle; to be riotous​
溢れる (afureru)	 to overflow; to brim over; to flood
愛着 (aichaku)	 attachment; love; covetous affection​
合間 (aima)	 interval; break; pause; spare moment​
曖昧 (aimai)	 vague; ambiguous; unclear​
愛らしい (airashii)	 pretty; charming; lovely; adorable
愛社 (aisha)	 devotion to one’s company​
相性 (aishou)	 affinity; compatibility​
相次いで (aitsuide)	 one after the other; successively​
愛用 (aiyou)	 favorite; habitually used​
味付け (ajitsuke)	 seasoning; flavor​
赤字 (akaji)	 (being in) the red; deficit; red letter; red writing​; corrections (by a teacher or proofreader) written in red​
飽き (aki)	 weariness; boredom; tedium; tiresomeness​
空き地 (akichi)	 vacant land; unoccupied ground; empty lot​
諦め (akirame)	 resignation; acceptance; consolation​
悪化 (akka)	 (suffer) deterioration; growing worse; aggravation; degeneration; corruption​
憧れ (akogare)	 yearning; longing; aspiration; adoration; admiration​
憧れる (akogareru)	 to long for; to yearn after; to admire; to be attracted by
悪影響 (akueikyou)	 bad influence; negative influence​
悪意 (akui)	 ill will; spite; evil intention; malice​; bad meaning​
悪条件 (akujouken)	 unfavorable conditions; unfavourable conditions​
雨水 (amamizu/usui)	 rain water
甘やかす (amayakasu)	 to pamper; to spoil​
案外 (angai)	 unexpectedly; surprisingly​; unexpected; unanticipated; unforeseen; surprising
安易 (an’i)	 easy; simple​; easygoing; lighthearted; simplistic; irresponsible; careless; quick (to do)​
安価 (anka)	 low-priced; cheap; inexpensive​
仰向け (aomuke)	 face up
荒い (arai)	 rough; wild; violent; rude; coarse; harsh; fierce; heavy (e.g. breathing)​; immoderate; extravagant; reckless​
洗い出す (araidasu)	 to reveal something by washing the surface​; to bring to light; to reveal by investigation​
予め (arakajime)	 beforehand; in advance; previously​
争う (arasou)	 to compete; to contest; to contend​; to quarrel; to argue; to dispute; to be at variance; to oppose​
改める (aratameru)	 to change; to alter; to revise; to replace; to reform; to correct; to mend; to improve​
荒れる (areru)	 to be stormy; to be rough​; to be ruined; to fall into ruin​; to be in a bad temper; to lose one’s temper​
焦り (aseri)	 impatience
焦る (aseru)	 to be in a hurry; to be impatient; to be flustered; to lose one’s presence of mind; to be surprised​
足を運ぶ (ashi o hakobu)	 to go; to come; to turn out (at a meeting, event, etc.); to show up; to make your way to​
圧勝 (asshou)	 complete victory​
宛 (ate)	 addressed to
当てはまる (atehamaru)	 to apply (a rule); to be applicable; to come under (a category); to fulfill; to hold true​
後回し (atomawashi)	 putting off; postponing​
後戻り (atomodori)	 going backward; turning back; backtracking; doubling back​; retrogression; relapse; returning to a bad state​
あっという間 (attoiuma)	 a blink of time
厚かましい (atsukamashii)	 impudent; shameless; brazen​
慌ただしい (awatadashii)	 busy; hurried; confused; flurried
怪しい (ayashii)	 suspicious; dubious; doubtful; dodgy; suspicious (referring to a potential amorous relation); dangerous (e.g. financial situation); ominous (e.g. weather); strange; shady; fishy​
歩み寄る (ayumiyoru)	 to compromise; to meet halfway​; to step up to; to walk up to; to approach​
歩む (ayumu)	 to walk; to go on foot​
鮮やか (azayaka)	 vivid; bright; brilliant; clear; fresh; vibrant​; skillful; brilliant; beautiful; fine; excellent​
倍増 (baizou)	 double
離れ (banare)	 (suffix) separation from; loss of interest in; independence of; distancing (of oneself) from; disillusionment with; alienation from (something)
ばっさり	 with a single stroke; resolutely; drastically; completely​
別荘 (bessou)	 holiday house; vacation home; villa; prison; jail
美術 (bijutsu)	 art; fine arts​
敏感 (binkan)	 sensitive; alert; aware; susceptible​
びっしょり	 wet through; drenched​
美容院 (biyouin)	 beauty parlor; beauty salon; hairdressing salon​
募金 (bokin)	 fund-raising; collection of funds​
牧場 (bokujou)	 farm (livestock); ranch (US); pasture land; meadow; grazing land​
膨大 (boudai)	 huge; vast; enormous; colossal; extensive; large​; swelling; expansion
防犯 (bouhan)	 prevention of crime​
防災 (bousai)	 prevention of damage resulting from a natural disaster; protection against disaster​
部員 (buin)	 staff; member (club, society, etc.)​
部下 (buka)	 subordinate person​
ぶかぶか	 too large (clothing); baggy; loose-fitting
分別 (bunbetsu)	 separation (e.g. of rubbish when recycling); classification; discrimination; division; distinction​
分解 (bunkai)	 disassembly; dismantling; disaggregating; analysis; disintegrating; decomposing; degrading​
分割 (bunkatsu)	 partition; division; separation; segmenting; splitting​
文系 (bunkei)	 humanities, social sciences, and fine arts; liberal arts
文献 (bunken)	 literature; books (reference); document​
文面 (bunmen)	 content of a letter​
分配 (bunpai)	 division; splitting; sharing; distribution; dissemination; allocation​
分量 (bunryou)	 amount; quantity​
分担 (buntan)	 taking on one’s share (e.g. of work); dividing (work, expenses, etc.) between; apportionment; allotment; allocation; assignment​
物資 (busshi)	 goods; materials; commodities; resources; supplies
着々と (chakuchaku to)	 steadily
着実 (chakujitsu)	 steady; sound; solid; reliable; trustworthy​
縮める (chidjimeru)	 to shorten; to reduce; to condense; to shrink​; to make (one’s body) smaller; to draw in (one’s legs); to duck (one’s head)​
縮む (chidjimu)	 to shrink; to contract; to diminish (in size)​
近々 (chikadjika)	 soon; nearness; before long​
近づく (chikazuku)	 to approach; to draw near; to get close​; to get acquainted with; to get closer to; to get to know​
蓄積 (chikuseki)	 accumulation; accumulate; store​
散らかす (chirakasu)	 to scatter around; to leave untidy​
地帯 (chitai)	 area; zone; belt (of land)​
知的 (chiteki)	 intellectual
地点 (chiten)	 site; point on a map; spot​
地球温暖化 (chikyuuondanka)	 global warming​
直結 (chokketsu)	 direct connection; direct link​
直後 (chokugo)	 immediately following​
直立 (chokuritsu)	 standing upright; standing straight
直前 (chokuzen)	 just before​
長編 (chouhen)	 long (e.g. novel, film)​
長方形 (chouhoukei)	 rectangle; oblong​
長期間 (choukikan)	 long period (of time)​
彫刻 (choukoku)	 carving; engraving; sculpture​
彫刻家 (choukokuka)	 engraver; carver; sculptor​
長距離 (choukyori)	 long distance; long haul​
調味料 (choumiryou)	 seasoning; flavoring; flavouring; condiment​
調理 (chouri)	 cooking; food preparation​
調整 (chousei)	 adjustment; regulation; coordination; reconciliation; tuning; fixing; tailoring​
調節 (chousetsu)	 regulation; adjustment; control​
聴衆 (choushuu)	 audience; attendance; hearers​
注意点 (chuuiten)	 important point; point to make note of​
抽象 (chuushou)	 abstraction
中断 (chuudan)	 interruption; suspension; break​
注意深い (chuuibukai)	 careful
忠実 (chuujitsu)	 faithful; devoted; loyal; honest; true​
中旬 (chuujun)	 middle of a month; second third of a month; 11th to 20th day of a month​
中華 (chuuka)	 Chinese food
中継 (chuukei)	 relay; relay broadcasting
駐輪所 (chuurinjo)	 bicycle parking place​
抽選 (chuusen)	 lottery; raffle; drawing (of lots)​
大学院 (daigakuin)	 graduate school
大学祭 (daigakusai)	 university festival; rag day
台無し (dainashi)	 mess; spoiled; spoilt; (come to) nothing; ruin​
題名 (daimei)	 title
段取り (dandori)	 programme; program; plans; arrangements​
段階 (dankai)	 grade; level; stage; class; phase; steps; order; gradation​
団結 (danketsu)	 unity; union; solidarity; combination; teaming up​
だらし無い (darashinai)	 slovenly (appearance, work, etc.); sloppy; untidy; undisciplined; careless; loose; slack​; weak; feeble; weak-willed; gutless​
脱出 (dasshutsu)	 escape; break-out​; prolapse; proptosis​
妥当 (datou)	 valid; proper; right; appropriate; reasonable​
出来上がる (dekiagaru)	 to be completed; to be finished; to be ready (e.g. to serve or eat)​
電源 (dengen)	 source of electricity; electrical power​; power (button on TV, etc.)​
電気屋 (denkiya)	 electric appliance store​
電波 (denpa)	 radio wave; reception; signal
伝染 (densen)	 contagion; infection​
伝達 (dentatsu)	 transmission (e.g. news, chemical signals, electricity); communication; delivery; conveyance; transfer; relay; propagation; conduction​
でたらめに	 nonsense; irresponsible remark; codswallop; hogwash; rubbish
土台 (dodai)	 foundation; base; basis​
独占 (dokusen)	 monopoly; monopolization; exclusivity​; keeping to oneself​
読者 (dokusha)	 reader
独身者 (dokushinsha)	 unmarried person; bachelor
道中 (douchuu)	 during the journey; on the way; while travelling​
動機 (douki)	 motive; incentive​
同居 (doukyo)	 coexistence; living together​
同年代 (dounendai)	 the same generation; coeval​
導入 (dounyuu)	 introduction; bringing in; leading in; installation​
動作 (dousa)	 action; movements; motions; bearing; behaviour; behavior; execution; actuation; operation; manners​
同等 (doutou)	 equality; equal; same rights; same rank; equivalence​
絵本 (ehon)	 picture book​
影響力 (eikyouryoku)	 influence; clout; leverage​
映像 (eizou)	 image (on a screen); picture (e.g. on a TV)​; video; film; footage​
駅前 (ekimae)	 in front of station
延長 (enchou)	 extension; elongation; prolongation; lengthening​
円形 (enkei)	 round shape; circle; circular form​
演じる (enjiru)	 to perform (a play); to play (a part); to act (a part); to commit (a blunder)​
円満 (enman)	 harmonious; peaceful; happy; amicable; smooth; free from trouble​
襟 (eri)	 collar; lapel; neckband; neck​; nape of the neck; scruff of the neck​
不安定 (fuantei)	 instability; insecurity; crankiness​
不調 (fuchou)	 bad condition; not to work out (i.e. a deal); disagreement; break-off; disorder; slump; out of form​
不動産 (fudousan)	 real estate​
不動産屋 (fudousan’ya)	 real estate agent; realtor​
不十分 (fujuubun)	 insufficient; inadequate; imperfect; shortage​
不快 (fukai)	 displeasure; discomfort; unpleasantness​; indisposition; ailment​
不可欠 (fukaketsu)	 indispensable; essential​
深まる (fukamaru)	 to deepen; to heighten; to intensify​
深める (fukameru)	 to deepen; to heighten; to intensify​
不完全 (fukanzen)	 imperfect; incomplete; faulty; defective​
不機嫌 (fukigen)	 pout; displeasure; ill humor; ill humour; sullenness
付近 (fukin)	 neighbourhood; neighborhood; vicinity; environs​
不規則 (fukisoku)	 irregularity; unsteadiness; disorderly​
副 (fuku)	 assistant; associate; vice-; sub-; deputy
含める (fukumeru)	 to include (in a group or scope)​; to include (a nuance); to put in (an implication)​
膨らます (fukuramasu)	 to swell; to expand; to inflate; to bulge​
膨らむ (fukuramu)	 to expand; to swell (out); to get big; to become inflated​
福祉 (fukushi)	 welfare; well-being; social welfare; social security; social service​
複数 (fukusuu)	 plural; multiple; several​
普及 (fukyuu)	 diffusion; spread; popularization; promulgation; familiarization​
不明 (fumei)	 unclear; obscure; indistinct; uncertain; ambiguous​; unknown; unidentified​
不明瞭 (fumeiryou)	 dimness; obscurity; indistinctness; unclear; unintelligible​
ふもと	 foot (of a mountain or hill); bottom; base
ふらふら	 unsteadily (e.g. on one’s feet); shakily; staggering; tottering; reeling; dizzily; giddily; wavering (in one’s mind); unsteadily; indecisively​
触れ合い (fureai)	 contact; connectedness; rapport; mutual touching​
触れ合う (fureau)	 to come into contact with; to touch (each other)
振り込み (furikomi)	 payment made via bank deposit transfer​
振り向く (furimuku)	 to turn one’s face; to turn around; to look over one’s shoulder​
不良品 (furyouhin)	 inferior goods; defective product; defective goods​
塞ぐ (fusagu)	 to stop up; to close up; to block (up); to plug up; to shut up; to cover (ears, eyes, etc.); to close (eyes, mouth)​; to stand in the way; to obstruct​; to occupy; to fill up; to take up​
不採用 (fusaiyou)	 rejection (of an application)​
負担 (futan)	 burden; load; responsibility​; bearing (a cost, responsibility, etc.); shouldering​
風 (fuu)	 appearance; air​
不愉快 (fuyukai)	 unpleasant; disagreeable; displeasing; uncomfortable; unhappy​
街 (gai)	 … street; … quarter; … district​
外観 (gaikan)	 outward appearance; exterior appearance; outward show; looks​
外見 (gaiken)	 outward appearance​
概要 (gaiyou)	 outline; summary; overview; abridgment; synopsis​
学費 (gakuhi)	 tuition; school expenses
学業 (gakugyou)	 studies; schoolwork; classwork​
学年 (gakunen)	 academic year; school year​
学歴 (gakureki)	 academic background​
学生課 (gakuseika)	 student affairs office​
願望 (ganbou)	 desire; wish; aspiration​
頑丈 (ganjou)	 solid; firm; stout; burly; strong; sturdy​
頑固 (ganko)	 stubborn; obstinate; pigheaded​
がらがら	 with a clatter; with a rattle​
がっしり	 firmly; solidly; sturdily; strongly; toughly
合宿 (gasshuku)	 lodging together; training camp; boarding house​
画用紙 (gayoushi)	 drawing paper
芸能 (geinou)	 public entertainment; performing arts​; accomplishments; attainments​
劇的 (gekiteki)	 dramatic; exciting; touching​; extreme
現代人 (gendaijin)	 modern person; people of today​
現時点 (genjiten)	 present point (i.e. in history); at the present time​
原稿 (genkou)	 manuscript; copy; draft; notes; contribution​
原理 (genri)	 principle; theory; fundamental truth​
原料 (genryou)	 raw materials​
原作 (gensaku)	 original work​
原産 (gensan)	 place of origin; habitat​
厳守 (genshu)	 strict observance; rigid adherence; scrupulous compliance​
原則 (gensoku)	 principle; general rule​
減速 (gensoku)	 deceleration
幻想 (gensou)	 fantasy; illusion; vision; dream​
限定 (gentei)	 limit; restriction​
現在地 (genzaichi)	 present location; current location; “you are here” (on map)​
議題 (gidai)	 topic of discussion; agenda​
疑問点 (gimonten)	 point of uncertainty; unclarified issue; doubt​
銀行員 (ginkouin)	 bank employee; bank staff member; bank clerk​
ぎりぎり	 just barely; only just; at the very limit; at the last moment
儀式 (gishiki)	 ceremony; rite; ritual; service​
ぎっしり	 tightly (packed); densely; closely; crammed​
ぎざぎざ	 notches; serration; indentation; jaggies (stair-step artifacts in computer images)​
ごちゃごちゃ	 messy; confused; chaotic; disorderly; mixed-up; jumbled up
強引 (gouin)	 overbearing; coercive; pushy; forcible; high-handed​
ぐったり	 limply; wearily; listlessly; languidly; exhaustedly; unenergetically
後日 (gojitsu)	 in the future; another day; later​
娯楽 (goraku)	 pleasure; amusement​
合同 (goudou)	 combination; union; incorporation; amalgamation; fusion
愚痴 (guchi)	 idle complaint; grumble​
ぐんぐん	 rapidly; vigorously; by leaps and bounds; steadily​
行事 (gyouji)	 event; function​
行列 (gyouretsu)	 line; queue; procession; parade​
幅広い (habahiroi)	 extensive; wide; broad​
蜂 (hachi)	 bee; wasp
蜂蜜 (hachimitsu)	 honey
鉢植え (hachiue)	 potted plant​
破片 (hahen)	 fragment; broken piece; splinter; chip; shard​
背景 (haikei)	 background; scenery; backdrop; setting; circumstance; context​; backing; support (from behind the scenes)​
廃止 (haishi)	 abolition; repeal​
墓参り (hakamairi)	 visit to a grave​
発揮 (hakki)	 show (of power, ability, etc.); exhibition; demonstration; display; manifestation​
泊 (haku)	 counter for nights of a stay​
白衣 (hakui)	 white robe; (doctor’s) white gown​
鼻水 (hanamizu)	 nasal mucus; dripping nose; snot​
話し合い (hanashiai)	 discussion; conference​
話し声 (hanashigoe)	 speaking voice; talking voice​
話し手 (hanashite)	 speaker
販売者 (hanbaisha)	 seller; vendor​
反映 (han’ei)	 reflection (light, image, situation, attitude, etc.); reflecting​; influence; application (e.g. of an update)​
半額 (hangaku)	 half the amount (of money); half price; half fare​
半減 (hangen)	 reduction by half; halving​
恥 (haji)	 shame; embarrassment; disgrace​
反感 (hankan)	 antipathy; antagonism; animosity; revulsion; ill feeling​
半日 (hannichi)	 half day
反発 (hanpatsu)	 opposition; rebellion; revolt; resistance; backlash; refusal​; rebounding; recoiling; repulsion​
張り切る (harikiru)	 to be in high spirits; to be full of vigor (vigour); to be enthusiastic; to be eager; to stretch to breaking point​
反論 (hanron)	 objection; refutation; rebuttal; counterargument​
半数 (hansuu)	 half the number
腹を立てる (hara o tateru)	 to take offense; to take offence; to get angry; to lose one’s temper
張り紙 (harigami)	 paper patch; paper backing; poster; sticker; label​​
挟む (hasamu)	 to hold between (e.g. one’s fingers, chopsticks); to grip (from both sides)​; to put between; to sandwich between; to insert; to interpose​; to insert (e.g. a break into proceedings); to interpose (e.g. an objection); to interject; to throw in (e.g. a joke)​
発散 (hassan)	 emission; emanation; radiation; diffusion; dispersion​; letting out (feelings); venting​
発想 (hassou)	 idea; conception; way of thinking
発送 (hassou)	 sending; forwarding; shipping​
働き手 (hatarakite)	 worker; breadwinner; supporter​; able person; able man; productive worker​
果たす (hatasu)	 to accomplish; to achieve; to carry out; to fulfill; to fulfil; to realize; to execute; to perform; to do​
発言 (hatsugen)	 statement; remark; observation; utterance; speech; proposal​
早口 (hayakuchi)	 fast-talking; rapid talking​
早まる (hayamaru)	 to be brought forward (e.g. by three hours); to be moved up; to be advanced​; to quicken; to speed up; to gather speed
流行り (hayari)	 fashion; fad; vogue; craze​
隔てる (hedateru)	 to separate (by distance, time, etc.); to isolate; to partition; to divide​; to interpose; to have between​; to alienate; to estrange​
平凡 (heibon)	 ordinary; common; commonplace; mediocre; unremarkable; undistinguished; uneventful​
平気 (heiki)	 coolness; calmness; composure; unconcern​
弊社 (heisha)	 our firm; our company (humble)
閉店 (heiten)	 closing up shop (for the day)​; stopping business; going out of business​
変換  (henkan)	 change; conversion; transformation​
変形 (henkei)	 transformation; variation; metamorphosis; modification; deformation; variety; deformity; monster​
返金 (henkin)	 repayment
返品 (henpin)	 returned goods; returning purchased goods​
返信 (henshin)	 reply
偏食 (henshoku)	 unbalanced diet​
編集 (henshuu)	 editing; compilation​
返送 (hensou)	 sending back; return to sender​
返答 (hentou)	 reply; answer​
非 (hi)	 (prefix) un-; non-; an-​
日当たり (hiatari)	 exposure to the sun; sunny place​
非凡 (hibon)	 extraordinary; uncommon; remarkable; unusual; rare; prodigious​
日々 (hibi)	 every day; daily; day after day; days (e.g. good old days)​
必着 (hicchaku)	 must arrive; must be received​
日帰り (higaeri)	 day trip​
日頃 (higoro)	 normally; habitually​
引き込む (hikikomu)	 to pull into; to draw in; to bring in​; to win over
引き止める (hikitomeru)	 to detain; to check; to restrain​
引き取る (hikitoru)	 to take into one’s possession; to receive; to accept; to collect; to claim​; to take (a person) into one’s care; to take custody of; to adopt​
引き続き (hikitsuzuki)	 continuously; continually; without a break​; next; then; after that​
引き渡す (hikiwatasu)	 to deliver; to extradite; to stretch across; to hand over​
引っかかる (hikkakaru)	 to be caught in; to be stuck in​; to get mixed up in (trouble); to get entangled in (a problem); to be involved with​
筆記 (hikki)	 (taking) notes; copying​; writing
非公式 (hikoushiki)	 informal; unofficial​
惹く (hiku)	 to draw (attention, sympathy, etc.); to attract (e.g. interest)​
卑怯 (hikyou)	 cowardice; meanness; unfairness​
非難 (hinan)	 criticism; blame; censure; attack; reproach​
避難 (hinan)	 taking refuge; finding shelter; evacuation; escape; seeking safe haven​
品質 (hinshitsu)	 (material) quality​
比例 (hirei)	 proportion
広場 (hiroba)	 plaza; (public) square; piazza; forum; open space
広々 (hirobiro)	 extensive; spacious​
広がり (hirogari)	 spread; span; expanse; extent​
広げる (hirogeru)	 to spread; to extend; to expand; to enlarge; to widen; to broaden; to unfold; to open; to unroll; to unwrap​
秘書 (hisho)	 (private) secretary​; treasured book; secret book​
潜む (hisomu)	 to lurk; to be hidden; to be concealed; to lie dormant; to be latent​
筆者 (hissha)	 writer; author​
ひそひそ	 in a whisper; in a low voice; in undertones
密か (hisoka)	 secret; private; surreptitious​
秘する (hisuru)	 to keep secret; to conceal​
ひたすら	 intently; single‐mindedly; devotedly; solely; earnestly; with all one’s heart
人前 (hitomae)	 presence of other people; (in) public; (in) front of others​
ひと昔 (hitomukashi)	 ages; long time; decade; the past ten years​
一人残らず (hitorinokorazu)	 everyone
必要不可欠 (hitsuyoufukaketsu)	 essential; indispensable; imperative; necessary; compelling, vital, critical​
冷やす (hiyasu)	 to cool (from room temperature); to chill; to refrigerate; to calm down; to cool off; to regain one’s composure; to relax​; to be frightened (at); to be scared (of)​
日差し (hizashi)	 sunlight; rays of the sun​
保護者 (hogosha)	 guardian; protector; patron; parent​
保育園 (hoikuen)	 nursery school; day nursery; preschool​
保育所 (hoikusho)	 nursery school; nursery​
補助 (hojo)	 assistance; support; aid; help​; subsidy; supplement; subvention; grant-in-aid​
歩行 (hokou)	 walk
本番 (honban)	 performance; take; going before an audience or on-air​; game; season; crucial moment​
本業 (hongyou)	 principal occupation; core business​
本格 (honkaku)	 original method or procedure; serious; orthodox; classical; genuine​
本日 (honjitsu)	 today
本来 (honrai)	 originally; primarily​; essentially; intrinsically; naturally; by nature; in (and of) itself​
本社 (honsha)	 head office; main office; headquarters; parent company; this company; this shrine​
本心 (honshin)	 true feelings​
保守 (hoshu)	 maintenance; conservatism; conservativeness; conservation​
補足 (hosoku)	 supplement; complement​
細長い (hosonagai)	 long and narrow​
舗装 (hosou)	 pavement; road surface​
欲する (hossuru)	 to want; to desire
包丁 (houchou)	 kitchen knife; carving knife​
報道 (houdou)	 information; report; journalism; news​
放映 (houei)	 televising; broadcasting; airing​
放課後 (houkago)	 after school​
子供たちは、放課後集まって宿題をしている。
報告書 (houkokusho)	 (written) report​
方面 (houmen)	 direction; district; area​
方針 (houshin)	 policy; plan; course; principle; objective​
表示 (hyouji)	 indication; expression; showing; manifestation; demonstration​; display; displaying
評論 (hyouron)	 criticism; critique​
表紙 (hyoushi)	 cover (of a book, magazine, etc.); binding​
異 (i)	 (prefix) different
居場所 (ibasho)	 whereabouts; place; location; place where one belongs; where one fits in; place where one can be oneself​
いちいち	 one-by-one; separately; every single; each and every; without omission; fully; in detail​
一段 (ichidan)	 more; much more; still more; all the more​
一段落 (ichidanraku)	 reaching a stopping place; settling down (before the next stage); getting to a point where one can rest; completing the first stage (of the work)​
一面 (ichimen)	 one face; one surface​; the whole surface​; one aspect; one side​; (on) the other hand​
一覧 (ichiran)	 look; glance; sight; inspection​; summary; list; table; catalog; catalogue​
一例 (ichirei)	 example; an instance​
一時休業 (ichijikyuugyou)	 temporary suspension (of business); brief shutdown
著しい (ichijirushii)	 striking; remarkable; considerable​
一助 (ichijo)	 help; assistance​
遺伝 (iden)	 heredity; (genetic) inheritance​
遺伝子 (idenshi)	 gene; genetic
意外性 (igaisei)	 unpredictability; element of surprise​
意義 (igi)	 meaning; significance​
居心地 (igokochi)	 comfort
いい加減 (iikagen)	 irresponsible; perfunctory; careless​; lukewarm; half-baked; halfhearted; vague​; reasonable; moderate
言い訳 (iiwake)	 excuse; explanation
意地悪 (ijiwaru)	 malicious; ill-tempered; unkind​
怒り (ikari)	 anger; rage; fury; wrath; indignation​
生かす (ikasu)	 to make (the best) use of; to put to good use; to leverage (skills, attributes, experience, etc.); to capitalise on (experience, etc.)​
生き生き (ikiiki)	 in a lively way; vividly; freshly; animatedly; actively; energetically​
いきなり	 abruptly; suddenly; all of a sudden; without warning
生き残る (ikinokoru)	 to survive​
息抜き (ikinuki)	 taking a breather; relaxation; vent hole​
一見 (ikken)	 look; glimpse; glance​; apparently; seemingly​
