背負う (seou)	 to carry on one’s back​; to be burdened with; to take responsibility for​
設定 (settei)	 establishment; creation; posing (a problem); setting (movie, novel, etc.); scene​; options setting; preference settings; configuration; setup
説得力 (settokuryoku)	 persuasiveness; powers of persuasion; cogency​
節電 (setsuden)	 conservation of electricity; brownout​
車内 (shanai)	 inside a train, car, etc.​
社内 (shanai)	 within a company; in-house​
車両 (sharyou)	 rolling stock; railroad cars; wheeled vehicles​
写生 (shasei)	 sketching; drawing from nature; portrayal; description​
写真家 (shashinka)	 photographer
車窓 (shasou)	 train window; car window​
仕上げる (shiageru)	 to finish up; to complete; to finish off; to get through; to polish off​
痺れる (shibireru)	 to become numb; to go to sleep (e.g. a limb)​; to get an electric shock; to tingle (from an electric shock)​; to be excited; to be titillated; to be mesmerized; to be enthralled
絞る (shiboru)	 to wring (towel, rag); to squeeze; to press; to extract; to milk; to extort; to exploit​
志望 (shibou)	 wish; desire; ambition​
脂肪 (shibou)	 fat; grease; blubber; lard; suet​
渋い (shibui)	 astringent; bitter; puckery; rough; harsh; tart​; austere; elegant (and unobtrusive); refined; quiet (and simple); sober; sombre; subdued; tasteful (in a quiet way); understated​; sour (look); glum; grim; sullen; sulky​
試着 (shichaku)	 trying on clothes​
市長 (shichou)	 mayor
支援 (shien)	 support; backing; aid; assistance​
志願 (shigan)	 aspiration; volunteering; desire; application​
志願者 (shigansha)	 applicant; candidate
仕草 (shigusa)	 gesture; movement; action; behavior; behaviour; bearing; mannerism​
指標 (shihyou)	 index; indices; indicator​
支持 (shiji)	 support; backing; endorsement; approval​
司会 (shikai)	 leading a meeting; presiding over a meeting; officiating at a ceremony; chairmanship​; chairman; presenter; host; moderator; master of ceremonies
視界 (shikai)	 field of vision; visibility; view; visual field; (one’s) ken​
資格 (shikaku)	 qualifications; requirements; capabilities​
視覚 (shikaku)	 sense of sight; vision​
思考 (shikou)	 thought; consideration; thinking​
思考力 (shikouryoku)	 ability to think​
試行錯誤 (shikousakugo)	 trial and error
仕組み (shikumi)	 structure; construction; arrangement; contrivance; mechanism; workings​; plan; plot; contrivance​
至急 (shikyuu)	 urgent; pressing; immediate; prompt; express​; urgently; promptly; at once; right away; without delay; as soon as possible​
氏名 (shimei)	 full name; identity​
使命 (shimei)	 mission; errand​; task; duty; obligation​
締め切る (shimekiru)	 to close up​; to shut up (e.g. behind doors)​; to cut off (e.g. because a deadline has expired); to close off (e.g. subscription list)​
湿っぽい (shimeppoi)	 damp; humid; wet​; gloomy; melancholy​
湿る (shimeru)	 to become damp; to become moist; to become wet​
染み付く (shimitsuku)	 to be indelibly stained or ingrained; to be dyed in deeply​
芯 (shin)	 wick; marrow; staple (for stapler); (pencil) lead; stuffing; pith​; core; heart; centre; center
新 (shin)	 (prefix) new; neo-​
新築 (shinchiku)	 new building; new construction​
振動 (shindou)	 oscillation; vibration; swing (e.g. of a pendulum)​
進化 (shinka)	 evolution; progress​
進行 (shinkou)	 moving forward (e.g. vehicle); onward movement​; advance (work, procedure, etc.); advancement; progress​
真の (shinno)	 true; real; genuine; proper; utter​
進入 (shinnyuu)	 entry; approach; penetration​
新設 (shinsetsu)	 establishing; founding; setting up; organizing; establishment​
進出 (shinshutsu)	 advance; stepping forward; emerging
深夜 (shin’ya)	 late at night​
信頼性 (shinraisei)	 credibility; authenticity; confidence; reliability​
素人 (shirouto)	 amateur; layman; ordinary person; novice
視力 (shiryoku)	 eyesight
新品 (shinpin)	 (brand-)new article​
申請 (shinsei)	 application; request; petition​
申請書 (shinseisho)	 written application​
視察 (shisatsu)	 inspection; observation​
施設 (shisetsu)	 institution; establishment; facility​
質素 (shisso)	 simple; plain​; modest; frugal; reserved​
下書き (shitagaki)	 draft; rough copy​
親しむ (shitashimu)	 to be intimate with; to befriend​
指摘 (shiteki)	 pointing out; identification​
視点 (shiten)	 opinion; point of view; visual point​
しわ	 wrinkle; crease​; ripple
視野 (shiya)	 field of vision; view​; one’s outlook (e.g. on life); one’s horizons​
自然界 (shizenkai)	 nature; the natural world; realm of nature​
沈める (shizumeru)	 to sink; to submerge​; to floor (an opponent)​
諸 (sho)	 various; many; several​
初夏 (shoka)	 early summer
初回 (shokai)	 first time; first innings; initial attempt​
初期 (shoki)	 early (days); initial stage​; initial
食器類 (shokkirui)	 dinnerware; cutlery​
食 (shoku)	 (counter) meal
食費 (shokuhi)	 food expense​
職員 (shokuin)	 staff member; personnel​
職人 (shokunin)	 craftsman; artisan; tradesman; worker; workman​
食生活 (shokuseikatsu)	 eating habits​
初心者 (shoshinsha)	 beginner
初対面 (shotaimen)
書店 (shoten)	 bookshop; bookstore​
象徴 (shouchou)	 (abstract) symbol; emblem; representation
商業 (shougyou)	 commerce; trade; business​
勝敗 (shouhai)	 victory or defeat; issue (of battle); outcome​
賞品 (shouhin)	 prize; trophy
消費者 (shouhisha)	 consumer
生じる (shoujiru)	 to produce; to yield; to cause​; to result from; to arise; to be generated​
消化 (shouka)	 digestion (of food)​; digestion (of information); assimilation; thorough understanding​; consumption; absorption; using up; meeting (e.g. a quota); completion​
消極的 (shoukyokuteki)	 negative; passive; half-hearted; unmotivated​
照明 (shoumei)	 illumination; lighting​
正面 (shoumen)	 front; frontage; facade; main​
消耗 (shoumou)	 exhaustion; consumption; using up; dissipation; waste
小児科 (shounika)	 pediatrics
省略 (shouryaku)	 omission; abbreviation; abridgment; abridgement
詳細 (shousai)	 details; particulars; specifics​; detailed; specific; minute
少子化 (shoushika)	 declining birth rates; decrease in the number of children​
消失 (shoushitsu)	 dying out; disappearance; vanishing; elimination; loss; absence​
少数 (shousuu)	 minority; few​
焦点 (shouten)	 focus (e.g. photographic); focal point​
商店街 (shoutengai)	 shopping district; shopping street; downtown​
所有 (shoyuu)	 one’s possessions; ownership​
所属 (shozoku)	 belonging to (a group, organization, etc.); affiliation (with); being attached to; being under the control of​
主人公 (shujinkou)	 protagonist; main character; hero(ine) (of a story)​
主観 (shukan)	 subjectivity; subject (philosophical); ego​; one’s personal opinion; one’s own idea​
宿泊先 (shukuhakusaki)	 lodging place
祝日 (shukujitsu)	 national holiday; public holiday​
出版社 (shuppansha)	 publisher; publishing house; publishing company​
出発点 (shuppatsuten)	 starting point; point of departure​
主力 (shuryoku)	 main force; chief object; mainline​
主催 (shusai)	 sponsorship (i.e. conducting under one’s auspices); promotion; organizing; organising; hosting; staging​
出世 (shusse)	 success in life; getting ahead; successful career; promotion; climbing the corporate ladder; eminence​
出社 (shussha)	 going to work (e.g. in the morning); coming to work​
出身地 (shusshinchi)	 birthplace; native place​
出席者 (shussekisha)	 those present; attendance​
主体 (shutai)	 main constituent; core; nucleus​; subject (philosophical); protagonist​
取得 (shutoku)	 acquisition; obtaining; gaining possession; purchase​
出演 (shutsuen)	 performance; appearance (in a stage, film, TV show, etc.)​
出演者 (shutsuensha)	 performer; entertainer; actor​
集 (shuu)	 (suffix) collection; compilation​
修学旅行 (shuugakuryokou)	 excursion; field trip; school trip​
修業 (shuugyou)	 pursuit of knowledge; studying; learning; training; completing a course​
周辺 (shuuhen)	 circumference; outskirts; environs; around; in the area of; in the vicinity of​
周年 (shuunen)	 whole year; entire year​; -th year anniversary​
収納 (shuunou)	 storage; putting or stowing away​
秀才 (shuusai)	 bright person; talented student; prodigy​
就職活動 (shuushokukatsudou)	 job hunting; job searching​
収集 (shuushuu)	 collecting; accumulating; gathering​; collection (of art, stamps, insects, etc.)​
習得 (shuutoku)	 learning; acquisition (of a skill, knowledge, etc.)​
取材 (shuzai)	 news coverage; collecting data (e.g. for an article); covering (something for media)​
率直 (socchoku)	 frank; candid; straightforward; openhearted; direct; outspoken​
添える (soeru)	 to garnish; to accompany (as a card does a gift)​; to add to as support; to prop up​
側面 (sokumen)	 side; flank; profile; sidelight; lateral​; aspect; dimension​
速達 (sokutatsu)	 express; special delivery​
測定 (sokutei)	 measurement
即座に (sokuza)	 immediately; right away; on the spot​
染まる (somaru)	 to be dyed​; to be tainted; to be infected; to be stained; to be steeped​
そもそも	 in the first place; to begin with; from the start; originally; ab initio
揃える (soroeru)	 to collect; to gather; to get together; to complete (a collection)​; to arrange; to put in order; to prepare; to get ready​
揃う (sorou)	 to be complete; to be all present; to make a full set; to be satisfied (of conditions)​; to gather; to assemble; to be collected​
そそっかしい	 careless; thoughtless; hasty; rash​
素質 (soshitsu)	 character; qualities; genius; the makings of​
外側 (sotogawa)	 exterior; outside; outer; external; lateral​
添う (sou)	 to meet (wishes, expectations, etc.); to satisfy; to comply with; to live up to
沿う (sou)	 to run along; to run beside; to stick to (a line)​; to follow (a policy, plan, etc.); to act in accordance with; to align with​
総 (sou)	 (prefix)	 whole; all; general; gross; entire; overall​
送付 (soufu)	 sending (esp. email attachments); forwarding; remitting​
総額 (sougaku)	 sum total; total amount​
相互 (sougo)	 mutual; reciprocal​
総合 (sougou)	 synthesis; coordination; putting together; integration; composite​; comprehensive
相違 (soui)	 difference; discrepancy; variation​
倉庫 (souko)	 storehouse; warehouse; godown​
送客 (soukyaku)	 sending customers (somebody’s way)​
総務 (soumu)	 general affairs; general business; manager; director; adjutant general​
相応 (souou)	 suitable; appropriate; befitting; becoming; adequate; reasonable; proper​
創立 (souritsu)	 establishment; founding; organization; organisation​
送料 (souryou)	 postage; carriage; shipping charge​
創作 (sousaku)	 creation; production; creative work (novel, film, etc.); original work; (creative) writing​; fabrication; fiction; invention​
送信 (soushin)	 transmission; sending​
総数 (sousuu)	 total (number); count​
相対的 (soutaiteki)	 relative
そうとう	 corresponding to (in meaning, function, etc.); being equivalent to​; appropriate; suitable; befitting; proportionate​
創造 (souzou)	 creation
騒々しい (souzoushii)	 noisy; loud; boisterous; clamorous; raucous​; turbulent; unsettled; restless​
素材 (sozai)	 ingredient; (raw) material; resource​; unprocessed timber; raw timber​
据える (sueru)	 to place (in position); to fix; to set (e.g. table); to lay (foundation)​; to install; to seat (someone); to settle (upon something); to fix (e.g. one’s gaze)​
水分 (suibun)	 water; liquid; fluid; moisture; humidity; sap; juice​
垂直 (suichoku)	 vertical
水平 (suihei)	 horizontal; level; even​
水面 (suimen)	 water’s surface​
推薦書 (suisensho)	 recommendation; nomination​
吸い取る (suitoru)	 to absorb; to squeeze (money)​
好き嫌い (sukikirai)	 likes and dislikes; pickiness (about food); choosiness; fussiness; tastes; preferences​
すっきり	 refreshingly; with a feeling of relief; pleasantly; (a weight) off one’s shoulder​; shapely; neatly; cleanly; without trouble​
住まい (sumai)	 dwelling; house; residence; address​
済ます (sumasu)	 to finish; to get it over with; to conclude​; to settle; to pay back​
隅々 (sumizumi)	 nooks; corners​
素直 (sunao)	 obedient; meek; docile; unaffected​; honest; frank; upfront (about one’s feelings)​
すらすら	 smoothly; easily; readily
数値 (suuchi)	 numerical value; numerics​; reading (on a meter, etc.)​
数分 (suufun)	 several minutes; a few minutes​
数量 (suuryou)	 quantity; volume; amount​
多 (ta)	 (prefix)	 multi-
束ねる (tabaneru)	 to tie up in a bundle (e.g. straw, hair, bills, letters); to bundle; to sheathe​; to govern; to manage; to control; to administer​
旅先 (tabisaki)	 destination; goal (of travel); place one stays during a journey​
立ち止まる (tachidomaru)	 to stop (in one’s tracks); to come to a stop; to halt; to pause; to stand still​
たちまち	 in an instant; in a moment; immediately; right away; at once; suddenly; all of a sudden; all at once
多大 (tadai)	 great (quantity, amount, etc.); huge; enormous; serious​
辿り着く (tadoritsuku)	 to arrive at (after a struggle); to finally reach; to find one’s way to; to finally hit on (e.g. an idea)​
耐える (taeru)	 to bear; to stand; to endure; to put up with​; to support; to withstand; to resist; to brave​
多額 (tagaku)	 large (amount of money); huge; hefty; expensive
多発 (tahatsu)	 repeated occurrence​
対 (tai)	 opposite; opposition​; versus; vs.; v.​
大別 (taibetsu)	 general classification; broad categorization​
体調 (taichou)	 physical condition; state of health​
体外 (taigai)	 ectogenesis; outside the body​
対比 (taihi)	 contrast; comparison
体感 (taikan)	 bodily sensation; sense; experience​
退場 (taijou)	 exit (from a stage); leaving; exit​
体格 (taikaku)	 physique; constitution​
体型 (taikei)	 figure; body shape; build; physique; form​
体験 (taiken)	 personal experience; physical experience; one’s own experience​
対抗 (taikou)	 opposition; antagonism​
体内 (tainai)	 interior of the body​
対応 (taiou)	 correspondence (to); equivalence​
対立 (tairitsu)	 suitability; coordination; matching; being appropriate (for)​
対策 (taisaku)	 measure; provision; step; countermeasure; counterplan; countermove​
体制 (taisei)	 order; system; structure; set-up; organization; organisation​
対戦 (taisen)	 waging war; competition​
退社 (taisha)	 resignation; leaving office​; leaving work (e.g. at the end of the day)​
体質 (taishitsu)	 constitution (physical); physical make-up; predisposition (to disease); disposition; tendency​; character (of a group, organization, etc.); innate characteristics; make-up; nature; culture​
対処 (taisho)	 dealing with; coping with​
退職 (taishoku)	 retirement; resignation​
対象外 (taishougai)	 not covered (by); not subject (to)​
退出 (taishutsu)	 leaving (e.g. work at end of day); withdrawal (e.g. from a noble’s or superior’s presence); exit (e.g. from a market)​
大敵 (taiteki)	 great rival; powerful enemy; archenemy​
対等 (taitou)	 equality (esp. of status, on equal terms); equivalence​
高まる (takamaru)	 to rise; to swell; to be promoted​
高め (takame)	 high (e.g. ball in baseball); highish; on the high side​; on the expensive side; comparatively expensive
高める (takameru)	 to raise; to lift; to boost; to enhance​
滝 (taki)	 waterfall
宅配 (takuhai)	 home delivery​
宅配便 (takuhaibin)	 express home delivery service​
逞しい (takumashii)	 burly; strong; sturdy; indomitable; indefatigable; strong-willed; resolute; bold
蓄える (takuwaeru)	 to store; to save up; to stock up on; to lay in stock; to set aside​; to accumulate (e.g. knowledge); to build up (e.g. experience); to develop (e.g. one’s skills)​
たくましい	 burly; strong; sturdy; indomitable; indefatigable; strong-willed; resolute; bold​
溜める (tameru)	 to amass; to accumulate; to store​; to leave unpaid​
保つ (tamotsu)	 to keep; to preserve; to hold; to retain; to maintain; to sustain​; to last; to endure; to keep well (food); to wear well; to be durable​
多難 (tanan)	 full of troubles, difficulties​
単調 (tanchou)	 monotony; monotone; dullness​
単純明快 (tanjunmeikai)	 simple and clear; plain and simple
短期間 (tankikan)	 short term; short time​
頼もしい (tanomoshii)	 reliable; trustworthy​; hopeful; promising​
単身 (tanshin)	 alone; unaided; away from home​
短縮 (tanshuku)	 shortening; contraction; reduction; curtailment; abbreviation​
担当者 (tantousha)	 person in charge (of an area of work); person responsible; contact (person)​
たっぷり	 full; in plenty; ample​
多量 (taryou)	 large quantity; large amount​
多彩 (tasai)	 variegated; varicoloured; varicolored; multi-coloured; multi-colored; diverse​
他者 (tasha)	 another person; others​
多種多様 (tashutayou)	 a great variety of; diversity​
達成 (tassei)	 achievement; attainment; accomplishment; realization​
達成感 (tasseikan)	 sense of accomplishment​
多数 (tasuu)	 large number (of); many​; majority
畳む (tatamu)	 to fold (clothes, umbrella)​; to close (a shop, business)​
立て替える (tatekaeru)	 to pay for another; to pay someone else’s debt as a loan to him; to make temporary payment on a person’s behalf​
頼り (tayori)	 reliance; dependence​
多用 (tayou)	 busyness; a lot of things to do​; frequent use; heavy use (of); many uses​
多様 (tayou)	 diverse; varied
多様化 (tayouka)	 diversification
多様性 (tayousei)	 diversity; variety​
手が空く (te ga aku/te ga suku)	 to be free; to be available​
手に入れる (te ni ireru)	 to obtain; to procure​
手に付かない (te ni tsukanai)	 unable to concentrate on (due to distractions, etc.)​
手足 (teashi)	 hands and feet; limbs​
手早い (tebayai)	 nimble; quick; agile​
手帳 (techou)	 notebook; memo pad; (pocket) diary
手書き (tegaki)	 handwriting; handwritten; hand-painted; hand-drawn​
手軽 (tegaru)	 easy; simple; informal; offhand; cheap​
手頃 (tegoro)	 moderate; handy; convenient; reasonable​
定着 (teichaku)	 sticking (in one place, position, etc.); settling; fixing; adherence​; becoming established (of a custom, system, etc.); taking hold; taking root​
庭園 (teien)	 garden; park​
定員 (teiin)	 fixed number (of people); prescribed number (of regular personnel, students, etc.); quota; numerical limit; complement​
提示 (teiji)	 presentation; exhibit; suggest; citation​
定価 (teika)	 list price; regular price; established price​
低下 (teika)	 fall; decline; lowering; deterioration; degradation
低価格 (teikaku)	 low price
低気圧 (teikiatsu)	 low (atmospheric) pressure; low-pressure system; depression; cyclone​; bad temper; foul mood; tense situation​
低コスト (teikosuto)	 low cost
抵抗感 (teikoukan)	 antipathy; reluctance; resistance​
提供 (teikyou)	 offer; tender; providing; supplying; making available; donating (blood, organs, etc.)​; sponsoring (a TV program)​
定年 (teinen)	 retirement age​; years of service in a military rank before eligibility for promotion
手入れ (teire)	 care; looking after; repair; maintenance; tending; trimming; grooming​; (police) raid; crackdown​
停止 (teishi)	 stoppage; coming to a stop; halt; standstill​; ceasing (movement, activity, etc.); suspension (of operations); interruption (e.g. of electricity supply); cutting off​
的確 (tekikaku)	 precise; accurate; appropriate; exactly the right​
適性 (tekisei)	 aptitude; aptness; suitability​
手元 (temoto)	 at hand; on hand; nearby; close at hand​; way of moving one’s arms; skill​; money at hand; pocket money​
店長 (tenchou)	 shop manager​
展示 (tenji)	 exhibition; display​
転換 (tenkan)	 conversion; diversion; changeover; commutation; switchover​
点検 (tenken)	 inspection; examination; checking​
転勤 (tenkin)	 job transfer; job relocation; intra-company transfer​
転校 (tenkou)	 changing schools​
天候不順 (tenkoufujun)	 unseasonable weather; fickle weather; bad weather​
転校生 (tenkousei)	 transfer student; student changing schools​
添付 (tenpu)	 attaching (documents, etc.); appending; affixing​
手作業 (tesagyou)	 manual labor; manual procedures​
訂正 (teisei)	 correction; revision; amendment​
転職 (tenshoku)	 change of occupation; career change​
天才 (tenzai)	 genius; prodigy; natural gift​
手数料 (tesuuryou)	 handling charge; commission​
手続き (tetsuzuki)	 procedure; process; proceedings; formalities​
飛び散る (tobichiru)	 to fly around; to scatter​
飛び回る (tobimawaru)	 to fly about; to skip about; to bustle about​
乏しい (toboshii)	 meagre; meager; scarce; limited; destitute; hard up; lacking; scanty; poor​
問い合わせ (toiawase)	 enquiry; inquiry; query; interrogation
問い合わせる (toiawaseru)	 to enquire; to inquire; to seek information​
閉じこもる (tojikomoru)	 to seclude oneself; to shut oneself away​
問いかける (toikakeru)	 to ask a question​; to begin to ask a question​
溶かす (tokasu)	 to dissolve​; to melt
特効薬 (tokkouyaku)	 specific medicine; wonder drug; silver bullet
特色 (tokushoku)	 characteristic; feature; idiosyncrasy; personal color​
特殊 (tokushu)	 special; particular; peculiar; unique
特集 (tokushuu)	 feature (e.g. newspaper); special edition; report​
特定 (tokutei)	 specific; particular; designated; special​; specifying; designating; identifying; pinpointing​
得点 (tokuten)	 scoring; score; points made; marks obtained; goals; runs
共働き (tomobataraki)	 (husband and wife) both working; dual income​
伴う (tomonau)	 to accompany; to go hand in hand with; to be consequent upon; to be accompanied by; to bring with; to take with; to be involved in​
遠回り (toomawari)	 detour; roundabout way​
取扱 (toriatsukai)	 treatment; service; handling; management​
取り入れる (toriireru)	 to harvest; to reap​; to take in; to gather in​; to adopt (e.g. idea); to accept (e.g. advice); to introduce
取り組み (torikumi)	 bout (in sports, etc.); match; effort; initiative; dealing with; grappling with; wrestling with​
取り込む (torikomu)	 to take in; to bring in; to adopt (e.g. behaviour); to introduce; to win over; to please; to curry favour with; to flatter​
取り消し (torikeshi)	 cancellation; withdrawal; abolition; revocation; cancel
取り組む (torikumu)	 to grapple with; to wrestle with; to engage in a bout; to be matched against​; to tackle (e.g. a problem); to come to grips with; to work hard on​
取り除く (torinozoku)	 to remove; to deinstall; to take away; to set apart​
取り付く (toritsuku)	 to cling to; to hold on to; to hold fast to​; to set about doing; to begin; to commence; to undertake​
取り寄せる (toriyoseru)	 to order; to send away for; to have (something) sent to one​
都心 (toshin)	 city centre (center) (esp. capital city); urban centre; heart of city a metropolis​
年取る (toshitoru)	 to grow old; to age​
年上 (toshiue)	 older; senior​
整える (totonoeru)
整う (totonou)	 to be ready; to be prepared; to be arranged​; to be in order; to be put in order; to be well-ordered; to be well-proportioned; to be harmonious​; to be adjusted; to be regulated; to be refined (e.g. of a face)​
取っ手 (totte)	 handle; grip; knob​
逃亡 (toubou)	 escape; flight; running away; elopement; fleeing​
当分 (toubun)	 for the present; for the time being​
逃避 (touhi)	 escape; evasion; flight​
統一 (touitsu)	 unity; consolidation; uniformity; unification; compatible​
登場 (toujou)	 entry (on stage); appearance (on screen)​; entrance; introduction (into a market)​
統計 (toukei)	 statistics
陶器 (touki)	 porcelain (esp. soft-paste porcelain); china; chinaware; earthenware; pottery; ceramics; crockery​
登校 (toukou)	 attendance (at school); going to school​
透明 (toumei)	 transparent; clear​
登録 (touroku)	 registration; accession; register; entry; record​
討論 (touron)	 debate; discussion​
到達 (toutatsu)	 reaching; attaining; arrival​
到底 (toutei)	 by no means; not at all; (cannot) possibly; utterly; absolutely​
取り上げる (toriageru)	 to pick up​; to adopt (e.g. a proposal); to accept; to take up (a topic, complaint, etc.); to listen to; to deal with; to feature​
取り掛かる (torikakaru)	 to begin; to set about; to start​
取り戻す (torimodosu)	 to take back; to regain; to get back; to recover​
登山家 (tozanka)	 mountain climber; mountaineer​
潰す (tsubusu)	 to smash; to crush; to flatten​; to kill (time); to while away (the time)​
呟く (tsubuyaku)	 to mutter; to murmur; to grumble
追加 (tsuika)	 addition; supplement; appending; appendix​
追求 (tsuikyuu)	 pursuit (of a goal, ideal, etc.); search; chase; seeking after​
追及 (tsuikyuu)	 investigation (e.g. into someone’s guilt); questioning; pressing; hounding; pinning down​; catching up; overtaking​
使い分ける (tsukaiwakeru)	 to use properly; to use (different things) for different purposes​
付け加え (tsukekuwae)	 addition (to something)​
付け加える (tsukekuwaeru)	 to add (one thing to another); to add (a few more words, an explanation, etc.)​
作り上げる (tsukuriageru)	 to build up; to complete; to construct; to create; to invent; to cook up​
つまずく	 to stumble; to trip; to fail
